, Domain,intent,text,centroids_id,dist_score,avg_dist_score
843,Coronavirus Recommendations,Contact With Infected,What to do if you were potentially exposed to someone with coronavirus?,2,0.5661813637854929,0.6535774559158121
744,Employer Guidelines,Quarantine,What to do if my employee is undert quaranteen?,2,0.49258832768427985,0.6535774559158121
799,About Coronavirus,Fear,How serious i should be about coronavirus?,2,0.9572141055874428,0.6535774559158121
372,Coronavirus Recommendations,Visiting Elderly,Is it OK for me still til visit senior citizens in their home or at their nursing homes?,3,0.5353282751490943,0.42640393439064483
707,Coronavirus Recommendations,Curfew,can I still go out of home?,3,0.7275190544865118,0.42640393439064483
246,Coronavirus Recommendations,Visiting Elderly,am I still allowed to visit my grandparents at their house or retirement home,3,0.3818974831087154,0.42640393439064483
845,Coronavirus Recommendations,Visiting Elderly,can i still visit my grandmother at her house?,3,0.2885418740662584,0.42640393439064483
416,Coronavirus Recommendations,Visiting Elderly,Can I still visit my nan in her home?,3,0.23120407128011772,0.42640393439064483
524,Coronavirus Recommendations,Visiting Elderly,can i still visit my grandparents ,3,0.4101683913219081,0.42640393439064483
159,Coronavirus Recommendations,Visiting Elderly,Can I still visit my grandparents?,3,0.4101683913219081,0.42640393439064483
576,About Coronavirus,Mortality Rate,How many people die because of the virus?,4,0.45632891014642557,0.3596109292894563
675,About Coronavirus,Mortality Rate,how many percent of infecet people die,4,0.24441084251413184,0.3596109292894563
657,About Coronavirus,Mortality Rate,How many out of a hundred people will die from Corona ,4,0.3311164634707445,0.3596109292894563
169,About Coronavirus,Mortality Rate,How often do people die from coronavirus?,4,0.4093255534176014,0.3596109292894563
454,About Coronavirus,Mortality Rate,What percentage of people die from coronavirus?,4,0.3809570510531465,0.3596109292894563
771,About Coronavirus,Mortality Rate,How many people die from Coronavirus?,4,0.3355267551346881,0.3596109292894563
357,About Coronavirus,What Is Coronavirus,What is coronavirus?,5,0.1668750956817075,0.26700015309073205
704,About Coronavirus,What Is Coronavirus,What is coronavirus?,5,0.1668750956817075,0.26700015309073205
649,About Coronavirus,What Is Coronavirus,what is the coronavirus,5,0.1668750956817075,0.26700015309073205
196,About Coronavirus,What Is Coronavirus,what is coronavirus,5,0.1668750956817075,0.26700015309073205
199,About Coronavirus,Methods of Transmission,how does coronavirus infect?,5,0.6675003827268301,0.26700015309073205
872,Coronavirus Recommendations,Contact With Infected,my boyfriend is positive what do i do,6,0.5893415455392391,0.546829956512817
1026,Employer Guidelines,Sick Employee,What to do if your employee has tested positive for covid,6,0.6143108806254142,0.546829956512817
712,About Coronavirus,How Many Infected,how many have tested positive for coronavirus,6,0.6562277045146192,0.546829956512817
850,Coronavirus Recommendations,Pet,What do I do with my pet if I have tested positive for Coronavirus / COVID-19?,6,0.46295915818768923,0.546829956512817
317,Coronavirus Recommendations,Pet,What can I do with my pet if I have tested positive for Coronavirus?,6,0.42496179380942933,0.546829956512817
393,Coronavirus Recommendations,Contact With Infected,I have been close to a human who has been tested corona positive. What to do?,6,0.7577715594247892,0.546829956512817
584,Coronavirus Recommendations,Contact With Infected,my friend just tested positive and we hung out ealier this week. what do i do,6,0.6452963233744432,0.546829956512817
500,Coronavirus Recommendations,Pet,im positive. what about my pet?,6,0.7690433576902046,0.546829956512817
486,Coronavirus Recommendations,Pet,What do I do about my pet when tested positive for Corona virus ,6,0.5270585675965945,0.546829956512817
440,Coronavirus Recommendations,Pet,I've tested positive for corona. What should I do about my pet?,6,0.4383696073463644,0.546829956512817
789,Coronavirus Recommendations,Pet,What to do with my pet if i am tested covid-19 positive?,6,0.43752539707932137,0.546829956512817
1052,Coronavirus Recommendations,Contact With Infected,What do I do if my neighboor has been tested positive for COVID?,6,0.43989486172665115,0.546829956512817
211,Coronavirus Recommendations,Contact With Infected,what do i do if a person in my family is tested positive for covid19,6,0.6813602318457431,0.546829956512817
217,Coronavirus Recommendations,Pet,what do i do with my pet if i am tested positive?,6,0.37916417946587655,0.546829956512817
237,Coronavirus Recommendations,Pet,what do i do with my pet if I am tested positive?,6,0.37916417946587655,0.546829956512817
60,About Coronavirus,Testing,can anyone be tested for corona`,7,0.6178304869585196,0.45317801011373976
797,About Coronavirus,Testing,Who should be tested against coronavirus?,7,0.5183322342133415,0.45317801011373976
962,About Coronavirus,Testing,Should I get my grandfather tested?,7,0.3403031592347682,0.45317801011373976
404,About Coronavirus,Testing,Who should be tested?,7,0.3339091587208985,0.45317801011373976
465,About Coronavirus,Testing,Who is eligible for coronavirus test?,7,0.4163416526983765,0.45317801011373976
304,About Coronavirus,Testing,Who should be tested?,7,0.3339091587208985,0.45317801011373976
5,About Coronavirus,Testing,Who should be tested?,7,0.3339091587208985,0.45317801011373976
878,Coronavirus Recommendations,Doctor,should i get tested for corona? ,7,0.5356603093471934,0.45317801011373976
860,About Coronavirus,Testing,does my family need to get tested? ,7,0.679305800775525,0.45317801011373976
977,About Coronavirus,Testing,Who gets tested for the coronavirus?,7,0.516909855702493,0.45317801011373976
912,About Coronavirus,Testing,should everyone get tested,7,0.35710601967975736,0.45317801011373976
110,About Coronavirus,Testing,Who should be tested?,7,0.3339091587208985,0.45317801011373976
228,About Coronavirus,Testing,who should get a test?,7,0.4222030771167308,0.45317801011373976
637,About Coronavirus,Testing,Who has to be tested for Corona ,7,0.5468782537426229,0.45317801011373976
564,About Coronavirus,Testing,What people should be tested?,7,0.6614064517430246,0.45317801011373976
557,About Coronavirus,Testing,who is being tested,7,0.3339091587208985,0.45317801011373976
330,About Coronavirus,Testing,who should get tested,7,0.4222030771167308,0.45317801011373976
489,Coronavirus Recommendations,Pregnant,I am pregnant what to do to protect myself ,8,0.6165166451665256,0.5371264266301472
332,Coronavirus Recommendations,Pregnant,"I'm pregnant, what are my precautions?",8,0.6093865155749538,0.5371264266301472
3,Coronavirus Recommendations,Pregnant,What to do as a pregnant woman?,8,0.22555731964565373,0.5371264266301472
1008,Coronavirus Recommendations,Pregnant,What do I do if I’m pregnant? Is corona virus dangerous for me? ,8,0.7445818203223831,0.5371264266301472
505,Coronavirus Recommendations,Pregnant,what do i do if im pregnant,8,0.6707880594566752,0.5371264266301472
605,Coronavirus Recommendations,Pregnant,"I am pregnant, what shall I do to protect myself from the virus?",8,0.7662604004873533,0.5371264266301472
753,Coronavirus Recommendations,Pregnant,What to do if i am pregnant?,8,0.3340581944145852,0.5371264266301472
324,Coronavirus Recommendations,Pregnant,What can I do if I am pregnant?,8,0.3340581944145852,0.5371264266301472
139,Coronavirus Recommendations,Pregnant,What should a pregnant woman do to stay safe from the Coronavirus?,8,0.7515382521315144,0.5371264266301472
220,Coronavirus Recommendations,Pregnant,what do i do if being pregnant?,8,0.3340581944145852,0.5371264266301472
709,Coronavirus Recommendations,Pregnant,How should I behave if I am pregnant,8,0.6939357307834647,0.5371264266301472
106,Coronavirus Recommendations,Pregnant,What should I do if I am pregnant?,8,0.3340581944145852,0.5371264266301472
728,Coronavirus Recommendations,Pregnant,should i take extra precautions if im pregnant,8,0.7106403334350961,0.5371264266301472
443,Coronavirus Recommendations,Pregnant,I'm 36 weeks pregnant. Is there anything I need to do?,8,0.7191479824710926,0.5371264266301472
80,Coronavirus Recommendations,Pregnant,Should I be isolating if I am pregnant?,8,0.21231056231915527,0.5371264266301472
840,Coronavirus Recommendations,Employer,What are the steps to protect employees during coronavirus?,9,0.4424753190230356,0.5314667300861792
295,Coronavirus Recommendations,Employer,What can I do to protect my employees?,9,0.40093790835107007,0.5314667300861792
141,Coronavirus Recommendations,Mask,Do masks protect me from the Coronavirus?,9,0.6169924354040752,0.5314667300861792
624,Coronavirus Recommendations,Employer,What do I do to protect my employees from Corona ,9,0.5368632510008344,0.5314667300861792
493,Coronavirus Recommendations,Precautions,I have to travel how do I protect myself ,9,0.6470769576504655,0.5314667300861792
654,Coronavirus Recommendations,Actions At Home,Being at home... can I do anything else to protect myself?,9,0.6934249908181531,0.5314667300861792
782,Coronavirus Recommendations,Employer,How can i protect my employees?,9,0.40093790835107007,0.5314667300861792
596,Coronavirus Recommendations,Employer,I own a company? How should I protect my people?,9,0.6050844858043717,0.5314667300861792
594,Coronavirus Recommendations,Infection Prevention,How can protected myself and not get infected? ,9,0.6830178568590706,0.5314667300861792
623,Coronavirus Recommendations,Precautions,I'm going to do a trip. how can I protect myself during it?,9,0.5662903814813488,0.5314667300861792
604,Coronavirus Recommendations,Infection Prevention,How can I protect myself?,9,0.38356135793958474,0.5314667300861792
435,Coronavirus Recommendations,Employer,What can I do to protect my employees?,9,0.40093790835107007,0.5314667300861792
791,Coronavirus Recommendations,Actions If At Risk,What to do if i am a part of the risk group?,10,0.20290122764440074,0.36287985680181584
852,Coronavirus Recommendations,Actions If At Risk,What precautions should I take if I am part of a risk group?,10,0.5482497796546814,0.36287985680181584
318,Coronavirus Recommendations,Not At Risk,I'm not part of any known risk groups. What is my actions?,10,0.49456118359568696,0.36287985680181584
231,Coronavirus Recommendations,Children,are kids also part of the group of people more vulnerable to corona?,10,0.6042173327489705,0.36287985680181584
321,Coronavirus Recommendations,Actions If At Risk,What can I do if I am a part of an at risk group?,10,0.20290122764440074,0.36287985680181584
722,Coronavirus Recommendations,Actions If At Risk,what should i do if i'm part of an at risk group,10,0.20290122764440074,0.36287985680181584
329,Coronavirus Recommendations,Actions If At Risk,How should I react if I'm part of the risk groups? ,10,0.28442701868017034,0.36287985680181584
432,Coronavirus Recommendations,Postponed Surgeries,"I was scheduled to have rhinoplasty, are those kinds of surgeries postponed?",11,0.39982005746289684,0.3608708808047847
194,Coronavirus Recommendations,Postponed Surgeries,what kind of surgery is being postponed,11,0.24454897962313266,0.3608708808047847
516,Coronavirus Recommendations,Postponed Surgeries,what kinds of surgeries are being postponed,11,0.24454897962313266,0.3608708808047847
798,Coronavirus Recommendations,Postponed Surgeries,What kinds of surgeries are postponed for the future?,11,0.19784053727888648,0.3608708808047847
337,Coronavirus Recommendations,Postponed Surgeries,I would like to know which surgeries have been postponed,11,0.7175958500358748,0.3608708808047847
79,Coronavirus Recommendations,Actions If At Risk,What should I do if I'm in an at risk group?,12,0.3386867595581023,0.524029815621502
214,Coronavirus Recommendations,Not At Risk,what can i do if i am not in the known risk groups,12,0.37955137459045746,0.524029815621502
603,Coronavirus Recommendations,Not At Risk,I'm not in any risk group. Should I do anything?,12,0.6139011116408565,0.524029815621502
1007,Coronavirus Recommendations,Actions If At Risk,How to stay safe from corona virus if I am in a risk group?,12,0.786943129854591,0.524029815621502
851,Coronavirus Recommendations,People At Risk,What are the main risk groups for the disease?,12,0.6239090341880926,0.524029815621502
602,Coronavirus Recommendations,Actions If At Risk,"If I am in the risk group, what I shall do to protect myself?",12,0.7213974807977201,0.524029815621502
812,Coronavirus Recommendations,Actions If At Risk,What is the guidance for people in risk group?,12,0.3534947071838465,0.524029815621502
847,Coronavirus Recommendations,Not At Risk,What do I have to do if I don't belong to any of the risk groups?,12,0.38128707902055986,0.524029815621502
706,Coronavirus Recommendations,People At Risk,What group of people are of higher risk to get coronavirus?,12,0.5200843103230166,0.524029815621502
566,Coronavirus Recommendations,Not At Risk,What can I do if I do not belong to any of risk groups,12,0.38128707902055986,0.524029815621502
612,Coronavirus Recommendations,Actions If At Risk,I've seen I'm in a risk group. what should I do?,12,0.29459309502600695,0.524029815621502
693,Gatherings,Cancelling Gathering,why are there recommendations about not grouping people?,12,0.7936648840244126,0.524029815621502
300,Coronavirus Recommendations,Not At Risk,Do I have to take some special measure if I don't belong any risk group?,12,0.5789234113552952,0.524029815621502
1006,Coronavirus Recommendations,People At Risk,What are the risk groups for COVID-19? ,12,0.5686939621175101,0.524029815621502
673,About Coronavirus,Latest News,What’s the latest news about Corona ,13,0.39811225404501827,0.41146807984303463
698,About Coronavirus,Latest News,What are the latest news on Coronavirus?,13,0.30546582211448314,0.41146807984303463
389,About Coronavirus,Latest News,The latest news re the outbreak,13,0.5203301211085594,0.41146807984303463
718,About Coronavirus,Latest News,"latest news, please",13,0.401288663111962,0.41146807984303463
230,About Coronavirus,Latest News,what are the latest news about covid19?,13,0.23009838599390986,0.41146807984303463
804,About Coronavirus,Latest News,What are the latest news about coronavirus?,13,0.30546582211448314,0.41146807984303463
668,About Coronavirus,Latest News,what is the latest news,13,0.23009838599390986,0.41146807984303463
846,About Coronavirus,Latest News,what are the latest covid-19 news,13,0.46914171306395663,0.41146807984303463
451,About Coronavirus,Latest News,Is there any news on the virus?,13,0.7186356628151925,0.41146807984303463
301,About Coronavirus,Latest News,Latest news on Coronavirus,13,0.30546582211448314,0.41146807984303463
959,About Coronavirus,Latest News,Is there any news today?,13,0.6420462257974232,0.41146807984303463
474,Coronavirus Recommendations,Curfew,Is there a curfew?,14,0.2737550996247431,0.48145955302021276
768,Coronavirus Recommendations,Curfew,Is there a curfew now?,14,0.2737550996247431,0.48145955302021276
802,Coronavirus Recommendations,Curfew,Is a curfew on?,14,0.2737550996247431,0.48145955302021276
521,Coronavirus Recommendations,Curfew,is there a curfew,14,0.2737550996247431,0.48145955302021276
178,Coronavirus Recommendations,Curfew,is there a curfew,14,0.2737550996247431,0.48145955302021276
370,Coronavirus Recommendations,Curfew,Has the curfew been set in place?,14,0.5843885290471038,0.48145955302021276
735,Coronavirus Recommendations,Curfew,Has been a curfew introduced already?,14,0.6552053267535878,0.48145955302021276
157,Coronavirus Recommendations,Curfew,When is curfew?,14,0.2737550996247431,0.48145955302021276
917,Coronavirus Recommendations,Curfew,are we allowed to go out there? is there any curfew?,14,0.7369022201869376,0.48145955302021276
414,Coronavirus Recommendations,Curfew,Is there a curfew in effect and at what hours?,14,0.6306588878399342,0.48145955302021276
680,Coronavirus Recommendations,Curfew,is there currently a curfew,14,0.6117953934670917,0.48145955302021276
260,Coronavirus Recommendations,Curfew,Is there a curfew in effect?,14,0.6278102584221161,0.48145955302021276
627,Coronavirus Recommendations,Curfew,Have the authorities introduced a curfew already?,14,0.7696829757975345,0.48145955302021276
452,About Coronavirus,Pandemic,"I wanted to ask what a pandemic was, is that a videogame?",15,0.5496044943550493,0.5371134667201471
992,Coronavirus Recommendations,Not At Risk,What to do as a healthy person about the coronavirus pandemic?,15,0.6732663500135129,0.5371134667201471
599,Coronavirus Recommendations,Citizen,How can I collaborate to reduce the pandemic? ,15,0.33091731709900873,0.5371134667201471
573,About Coronavirus,Pandemic,what is a pandemic?,15,0.35293450609253585,0.5371134667201471
563,About Coronavirus,Pandemic,whats a pandemic,15,0.7693430329382055,0.5371134667201471
834,About Coronavirus,Pandemic,can you tell me what a pandemic is,15,0.6855784995972091,0.5371134667201471
669,Employer Guidelines,Refusal To Work,Someone in my team doesn't want to go to work because of the pandemic. What can I do?,15,0.8347135779296773,0.5371134667201471
976,About Coronavirus,Strategy,How do we fight the coronavirus pandemic?,15,0.3406153463176755,0.5371134667201471
819,About Coronavirus,Pandemic,What is a pandemic exactly?,15,0.7801538485775955,0.5371134667201471
980,About Coronavirus,Pandemic,What is a pandemic and who decides it,15,0.16873009001391612,0.5371134667201471
473,About Coronavirus,Pandemic,What a definition of pandemic?,15,0.7389765904077994,0.5371134667201471
163,Coronavirus Recommendations,Student,How can I continue my education during the pandemic?,15,0.5516251192273101,0.5371134667201471
307,About Coronavirus,Pandemic,What is a pandemic?,15,0.35293450609253585,0.5371134667201471
684,About Coronavirus,Pandemic,do you know what a pandemic is,15,0.6705650962610511,0.5371134667201471
710,About Coronavirus,Pandemic,what is a pandemic,15,0.35293450609253585,0.5371134667201471
1037,About Coronavirus,Pandemic,What is a pandemic?,15,0.35293450609253585,0.5371134667201471
394,About Coronavirus,Pandemic,Please explain what pandemic is ,15,0.8092805077619573,0.5371134667201471
772,About Coronavirus,Pandemic,What is pandemic?,15,0.35293450609253585,0.5371134667201471
316,Coronavirus Recommendations,Doctor,When should I go to the doctor?,16,0.19283127180200338,0.3361419554382312
121,About Coronavirus,Treatment,what do the doctors do if i have it?,16,0.5250908450434838,0.3361419554382312
439,Coronavirus Recommendations,Doctor,When can I go to the doctor?,16,0.19283127180200338,0.3361419554382312
849,Coronavirus Recommendations,Doctor,When do I have to go to the doctor?,16,0.19283127180200338,0.3361419554382312
56,Coronavirus Recommendations,Doctor,when should I go to the doctor+,16,0.19283127180200338,0.3361419554382312
787,Coronavirus Recommendations,Doctor,When should i go to the doctor?,16,0.19283127180200338,0.3361419554382312
994,Coronavirus Recommendations,Doctor,Do I go to the doctor if I have corona? ,16,0.3766532175856363,0.3361419554382312
683,About Coronavirus,Treatment,What do the doctors do to people with Corona ,16,0.7659778332412212,0.3361419554382312
606,Coronavirus Recommendations,Doctor,Should I go to the doctor?,16,0.19283127180200338,0.3361419554382312
485,Coronavirus Recommendations,Doctor,What symptoms do you have to have before you go to a medical doctor ,16,0.5367100276999506,0.3361419554382312
716,About Coronavirus,Status,what is the status for the coronavirus outbreak,17,0.6378572390851405,0.6009214012394591
108,About Coronavirus,Status,Status of COVID-19,17,0.5889686910730593,0.6009214012394591
714,About Coronavirus,Status,what is the current status for the outbreak,17,0.6986864655117905,0.6009214012394591
58,About Coronavirus,Status,what's the current status of covid 19? ,17,0.6717117274100131,0.6009214012394591
629,About Coronavirus,Status,What’s status with Corona in Denmark ,17,0.6713104162697755,0.6009214012394591
445,About Coronavirus,Status,What's teh status on corona?,17,0.3713022173523884,0.6009214012394591
298,About Coronavirus,Status,what is the status on the pandemi worldwide,17,0.8004394364168099,0.6009214012394591
175,About Coronavirus,Status,what is the status on corona virus,17,0.611980283868917,0.6009214012394591
670,About Coronavirus,Status,whats the status of the virus,17,0.772215014688914,0.6009214012394591
960,About Coronavirus,Status,What is the status?,17,0.3768848169706264,0.6009214012394591
297,About Coronavirus,Latest News,give me the latest status from my country,17,0.6511679800168231,0.6009214012394591
806,About Coronavirus,Status,What is the status of coronavirus?,17,0.47269820147578023,0.6009214012394591
232,About Coronavirus,Status,what is the latest status on covid19?,17,0.6149789257366112,0.6009214012394591
302,About Coronavirus,Status,What is the status of Coronavirus?,17,0.47269820147578023,0.6009214012394591
535,Employer Guidelines,Refusal To Travel,can my employee refuse to travel?,18,0.2946525756069778,0.4847037134520632
531,Employer Guidelines,Refusal To Travel,Is ok for an employee to refuse to travel ,18,0.3901023076648275,0.4847037134520632
275,Employer Guidelines,Refusal To Travel,Can an employee refuse to travel due to Coronavirus?,18,0.49077551287312177,0.4847037134520632
738,Employer Guidelines,Refusal To Travel,Can my employee refuse to travel because of coronavirus?,18,0.3299102792650104,0.4847037134520632
674,Employer Guidelines,Refusal To Travel,Can any of my workers refuse to travel during the pandemic?,18,0.5579220608185471,0.4847037134520632
43,Employer Guidelines,Refusal To Travel,are my employees allowed to refuse travelling because of corona?,18,0.5787981670749186,0.4847037134520632
833,Employer Guidelines,Refusal To Travel,Can Employees Refuse To Travel Out Of Fear Of Contracting coronavirus?,18,0.5844561920653069,0.4847037134520632
926,Employer Guidelines,Refusal To Travel,can employees refuse to travel in this period? Can we force them to do so?,18,0.6510126122477956,0.4847037134520632
537,About Coronavirus,What Do We Know About Coronavirus,What do you know about the corona?,19,0.4285598143707653,0.5317369896747324
667,About Coronavirus,What Do We Know About Coronavirus,How much do we know about Corona ,19,0.5876444954344932,0.5317369896747324
197,About Coronavirus,What Do We Know About Coronavirus,what do you know about coroa´navirus?,19,0.3457247867321229,0.5317369896747324
72,About Coronavirus,What Do We Know About Coronavirus,do we know how coronavirus impacts the humas ,19,0.3634076026834017,0.5317369896747324
463,About Coronavirus,What Do We Know About Coronavirus,What do you know about coronavirus?,19,0.5347004314475142,0.5317369896747324
402,About Coronavirus,What Is Coronavirus,I need to know about the corona. What is it?,19,0.6292634210722089,0.5317369896747324
748,About Coronavirus,What Do We Know About Coronavirus,How much do we know about coronavirus?,19,0.652883579648334,0.5317369896747324
1036,About Coronavirus,What Do We Know About Coronavirus,What do we know about corona?_,19,0.4285598143707653,0.5317369896747324
853,About Coronavirus,Symptoms,how do I know if I have Corona?,19,0.4285598143707653,0.5317369896747324
279,About Coronavirus,What Do We Know About Coronavirus,what do you as a chatbot know about corona that I can't read in the news?,19,0.5454217139055769,0.5317369896747324
871,Coronavirus Recommendations,Illness,i have a cough but i don't know if it's corona,19,0.34242431275617613,0.5317369896747324
122,About Coronavirus,What Is Coronavirus,Do you want to know what Coronavirus is?,19,0.706141293745059,0.5317369896747324
26,Employer Guidelines,Daycare,my employe can not get her kids look after and I don't know what to do?,19,0.7550393882132751,0.5317369896747324
941,Coronavirus Recommendations,Pregnant,I am with child and don’t know what to do ,19,0.695987386695796,0.5317369896747324
262,Coronavirus Recommendations,Border,Is the border closed?,20,0.31262344293377187,0.4939959586567854
179,Coronavirus Recommendations,Border,are the borders closed,20,0.31262344293377187,0.4939959586567854
522,Coronavirus Recommendations,Border,when does the borders open,20,0.7086537380291494,0.4939959586567854
415,Coronavirus Recommendations,Border,Is the border effectively closed now or can people still cross?,20,0.6542750454703153,0.4939959586567854
857,About Coronavirus,Latest News,did the government close the borders?,20,0.546866831300113,0.4939959586567854
1018,Coronavirus Recommendations,Border,Are the borders still open? Who can come into the country?,20,0.8355156093218883,0.4939959586567854
371,Coronavirus Recommendations,Border,I have a question regarding the close down of the border?,20,0.5694423112876829,0.4939959586567854
158,Coronavirus Recommendations,Border,Is the border closed?,20,0.31262344293377187,0.4939959586567854
631,Coronavirus Recommendations,Border,Are borders closed? ,20,0.31262344293377187,0.4939959586567854
770,Coronavirus Recommendations,Border,Which borders are closed?,20,0.31262344293377187,0.4939959586567854
510,Coronavirus Recommendations,Border,Can I cross the border to Germany ,20,0.5560847951466322,0.4939959586567854
98,Employer Guidelines,Vacation,yes,21,0.1218904414171332,0.19502470626741314
148,Coronavirus Recommendations,Student,yes,21,0.1218904414171332,0.19502470626741314
90,Coronavirus Recommendations,Children,"yes, as their parents WILL die",21,0.4875617656685328,0.19502470626741314
120,Coronavirus Recommendations,Contact With Infected,Yes,21,0.1218904414171332,0.19502470626741314
92,Coronavirus Recommendations,Swimming Hall,yes,21,0.1218904414171332,0.19502470626741314
