, Domain,intent,text,centroids_id,dist_score,avg_dist_score
482,Coronavirus Recommendations,Citizen,How do I minimize the spread of Coronavirus,54,0.3093479614641987,0.37471650656168204
648,Coronavirus Recommendations,Citizen,what can i do to minimize spreading the virus,54,0.33531745341125613,0.37471650656168204
774,About Coronavirus,Infection Through Food,Is it possible to get infected with coronavirus with food?,55,0.09807844310478303,0.13077125747304405
476,About Coronavirus,Infection Through Food,Is it possible to get infected with Coronavirus through food?,55,0.09807844310478303,0.13077125747304405
396,About Coronavirus,Infection Through Food,Is it possible to get infected through food?,55,0.19615688620956606,0.13077125747304405
1044,Coronavirus Recommendations,Public Spaces,can I go out?,56,0.3682986118075165,0.5309537479013128
1050,Coronavirus Recommendations,Curfew,can I go out?,56,0.3682986118075165,0.5309537479013128
988,Coronavirus Recommendations,Illness,can I go to the hospital? ,56,0.7002202787300565,0.5309537479013128
1025,Coronavirus Recommendations,Student,Should i go to school?,56,0.6869974892601616,0.5309537479013128
1045,Contact,Hotline,can I get in touch with a human?,57,0.5651239326316866,0.5349472150737392
393,Coronavirus Recommendations,Contact With Infected,I have been close to a human who has been tested corona positive. What to do?,57,0.6054956400159196,0.5349472150737392
87,Coronavirus Recommendations,People At Risk,all humans,57,0.43422207257361156,0.5349472150737392
222,Coronavirus Recommendations,Mask,am i supposed to wear a mask?,58,0.5670772068655002,0.6476135990323926
610,Coronavirus Recommendations,Mask,Shall I wear a face mask in the public places?,58,0.8415412780661728,0.6476135990323926
619,Coronavirus Recommendations,Mask,Must a wear a mask?,58,0.6876381453485731,0.6476135990323926
348,Coronavirus Recommendations,Mask,Do I need to wear a mask?,58,0.5455494640765756,0.6476135990323926
326,Coronavirus Recommendations,Mask,should I be wearing a mask?,58,0.3390386313160019,0.6476135990323926
508,Coronavirus Recommendations,Mask,am i supposed to wear a mask,58,0.5670772068655002,0.6476135990323926
870,Coronavirus Recommendations,Public Spaces,should i wear mask and gloves,58,0.6876381453485731,0.6476135990323926
233,Coronavirus Recommendations,Mask,is it really necessary to wear a mask?,58,0.7745767082261323,0.6476135990323926
428,Coronavirus Recommendations,Mask,"I see everyone wearing masks nowadays, is that something I should be doing?",58,0.870713482341694,0.6476135990323926
18,Coronavirus Recommendations,Mask,should I be wearing a mask when I am outside?,58,0.6277875541434175,0.6476135990323926
82,Coronavirus Recommendations,Mask,Should we be wearing N95 masks to protect us?,58,0.717618487322544,0.6476135990323926
38,Coronavirus Recommendations,Mask,should I wear a mask every time I go out?,58,0.7799579690661652,0.6476135990323926
757,Coronavirus Recommendations,Mask,Should i wear a mask?,58,0.3390386313160019,0.6476135990323926
491,Coronavirus Recommendations,Mask,Do I have to wear a mask to avoid catching Corona ,58,0.7213374761506431,0.6476135990323926
95,Employer Guidelines,Sick Employee,fire them immediately.,59,0.0,0.0
96,Employer Guidelines,Refusal To Work,fire them immediately.,59,0.0,0.0
236,Coronavirus Recommendations,Swimming Hall,If I swim in a public swimming pool am I then puttingmyself at risk,60,0.4333634920026238,0.4333634920026238
364,Coronavirus Recommendations,Swimming Hall,i usually swim in a indoor swimming pool. Am I at risk,60,0.43336349200262375,0.4333634920026238
767,Coronavirus Recommendations,Purchasing Groceries,Can i still do the groceries?,61,0.4780354503856186,0.5967563718483734
156,Coronavirus Recommendations,Purchasing Groceries,Is it safe to go to the grocery store?,61,0.6912728227089271,0.5967563718483734
259,Coronavirus Recommendations,Purchasing Groceries,Can I purchase groceries?,61,0.781593918449109,0.5967563718483734
715,Coronavirus Recommendations,Purchasing Groceries,can i still get groceries,61,0.5388465581075501,0.5967563718483734
413,Coronavirus Recommendations,Purchasing Groceries,Can I still go to the grocery store?,61,0.494033109590662,0.5967563718483734
270,Coronavirus Recommendations,Student,What are the recommendations for the students during COVID-19?,62,0.6816069438578577,0.7007982769348986
523,Coronavirus Recommendations,Student,I am a student what do I do about exams ,62,0.7696639817440727,0.7007982769348986
250,Coronavirus Recommendations,Student,"i am a student, how will you advice me in these times?",62,0.8335093262484774,0.7007982769348986
733,Coronavirus Recommendations,Student,If i am a student will i have classes?,62,0.7545339649072712,0.7007982769348986
813,Coronavirus Recommendations,Student,What should students do during coronavirus?,62,0.5467688894952811,0.7007982769348986
530,Coronavirus Recommendations,Student,what am i suppsed to do - im a student,62,0.8315913945270493,0.7007982769348986
923,Coronavirus Recommendations,Student,what am I supposed to do as a student?,62,0.7082204394352898,0.7007982769348986
661,Coronavirus Recommendations,Student,As an student... what are the recommendations for me during the crisis?,62,0.7478302873420934,0.7007982769348986
420,Coronavirus Recommendations,Student,"As a student, what can I do?",62,0.43345926485669506,0.7007982769348986
682,Coronavirus Recommendations,Closed Shops,are electronic stores closed due to coronavirus,63,0.6301072548060088,0.5775606668506345
717,Coronavirus Recommendations,Closed Shops,will regular stores close due to covid-19,63,0.6178396750132605,0.5775606668506345
154,Coronavirus Recommendations,Closed Shops,What's stores are closed?,63,0.4591558839303841,0.5775606668506345
195,Coronavirus Recommendations,Closed Shops,what kind of stores are closed due to covid19,63,0.5496615586304607,0.5775606668506345
630,Coronavirus Recommendations,Closed Shops,what stores are closed during the pandemic?,63,0.590759953710432,0.5775606668506345
711,Coronavirus Recommendations,Closed Shops,will variety stores close due to covid-19,63,0.6178396750132605,0.5775606668506345
856,About Coronavirus,Coronavirus Versus Influenza,is it more serious than the flu?,64,0.6043480964033886,0.4333887750962304
799,About Coronavirus,Fear,How serious i should be about coronavirus?,64,0.2894048826844954,0.4333887750962304
469,About Coronavirus,Fear,How serious we should be about Coronavirus?,64,0.2894048826844954,0.4333887750962304
166,About Coronavirus,Fear,Is coronavirus so serious? How worried should I be?,64,0.5503972386125422,0.4333887750962304
525,Employer Guidelines,Sick Employee,What do I do if one of my employees has Corona ,65,0.49765180257612746,0.588244669301519
644,Employer Guidelines,Sick Employee,What shall I do if one of my employees got infected?,65,0.6783362170861958,0.588244669301519
22,Employer Guidelines,Sick Employee,what should I do as one of my employees are sick?,65,0.607909633184165,0.588244669301519
271,Employer Guidelines,Sick Employee,What can I do if one of my employees has been infected?,65,0.3859770165503353,0.588244669301519
734,Employer Guidelines,Sick Employee,What to do if my employee is infected?,65,0.7388878134131046,0.588244669301519
998,Employer Guidelines,Sick Employee,One of my employees has corona. What do I need to do about it?,65,0.6207055329991855,0.588244669301519
174,About Coronavirus,Latest News,Send me information on corona virus,66,0.8241577256568537,0.6137998444325042
34,Coronavirus Recommendations,People At Risk,who is at risk of getting corona virus?,66,0.6654613217506097,0.6137998444325042
551,About Coronavirus,Latest News,Tell me the latest updates about the corona virus,66,0.8098431148941242,0.6137998444325042
954,About Coronavirus,What Do We Know About Coronavirus,What can you tell me about the corona virus?,66,0.5982637438758901,0.6137998444325042
1011,Coronavirus Recommendations,Precautions,What to do if I have to travel during corona virus!,66,0.6175742548282137,0.6137998444325042
536,About Coronavirus,What Is Coronavirus,What is the corona virus?,66,0.3906493750109191,0.6137998444325042
968,About Coronavirus,What Is Coronavirus,Is corona a virus?,66,0.3906493750109191,0.6137998444325042
69,About Coronavirus,Methods of Transmission,how can i get infected with Coronavirus? ,67,0.4365510598683217,0.5936066031482243
311,About Coronavirus,Infected Twice,Can I get infected more than once?,67,0.31360501182212275,0.5936066031482243
676,About Coronavirus,Methods of Transmission,How do you get infected by Corona ,67,0.5490340940067661,0.5936066031482243
221,Coronavirus Recommendations,Children,are kids in a high risk getting infected?,67,0.8742220577204779,0.5936066031482243
147,About Coronavirus,Methods of Transmission,how do i get it?,67,0.7369883790919121,0.5936066031482243
638,Coronavirus Recommendations,Actions At Home,What can I do at home not to get infected?,67,0.639405193176714,0.5936066031482243
594,Coronavirus Recommendations,Infection Prevention,How can protected myself and not get infected? ,67,0.6775305063021358,0.5936066031482243
786,Coronavirus Recommendations,Infection Prevention,What can i do to not get infected?,67,0.31360501182212275,0.5936066031482243
600,Coronavirus Recommendations,People At Risk,Who is at risk of getting infected and suffering from coronavirus?,67,0.8169850868981686,0.5936066031482243
1046,About Coronavirus,Infected Twice,can I be infected again?_,67,0.7351951740534043,0.5936066031482243
478,About Coronavirus,Infected Twice,Can I get infected more than once with coronavirus?,67,0.4365510598683217,0.5936066031482243
5,About Coronavirus,Testing,Who should be tested?,68,0.24300094564743938,0.4523247749236686
557,About Coronavirus,Testing,who is being tested,68,0.24300094564743938,0.4523247749236686
465,About Coronavirus,Testing,Who is eligible for coronavirus test?,68,0.8529337866210935,0.4523247749236686
110,About Coronavirus,Testing,Who should be tested?,68,0.24300094564743938,0.4523247749236686
564,About Coronavirus,Testing,What people should be tested?,68,0.6289162276100377,0.4523247749236686
304,About Coronavirus,Testing,Who should be tested?,68,0.24300094564743938,0.4523247749236686
797,About Coronavirus,Testing,Who should be tested against coronavirus?,68,0.4835006537796025,0.4523247749236686
404,About Coronavirus,Testing,Who should be tested?,68,0.24300094564743938,0.4523247749236686
60,About Coronavirus,Testing,can anyone be tested for corona`,68,0.8256856120258511,0.4523247749236686
637,About Coronavirus,Testing,Who has to be tested for Corona ,68,0.5172067409629051,0.4523247749236686
572,About Coronavirus,Strategy,what is the current strategy,69,0.2855856354612247,0.5136179705693853
303,About Coronavirus,Strategy,What is the current strategy for COVID-19?,69,0.49280635918248167,0.5136179705693853
299,About Coronavirus,Strategy,what is the current strategy in my state,69,0.6679886405721702,0.5136179705693853
446,About Coronavirus,Strategy,Is there a current strategy from the government?,69,0.5041988446697411,0.5136179705693853
403,About Coronavirus,Strategy,What is the current strategy?,69,0.2855856354612247,0.5136179705693853
796,About Coronavirus,Strategy,What is the strategy against coronavirus?,69,0.6440075289163507,0.5136179705693853
633,About Coronavirus,Strategy,What’s the current strategy to prevent Corona from spreading ,69,0.7041888970463297,0.5136179705693853
558,About Coronavirus,Strategy,What is the strategy now?,69,0.5720206747421923,0.5136179705693853
109,About Coronavirus,Strategy,What is the current strategy,69,0.2855856354612247,0.5136179705693853
456,About Coronavirus,Strategy,What is the government's current strategy regarding Coronavirus?,69,0.6942118541809131,0.5136179705693853
579,About Coronavirus,Infection Through Food,Can I get the virus from the food I eat?,70,0.4613429832652395,0.5092119097702206
1039,About Coronavirus,Infection Through Food,Can I get the virus eating?,70,0.4509946341828293,0.5092119097702206
204,About Coronavirus,Infection Through Food,can i get infected eating food?,70,0.46279407227503777,0.5092119097702206
937,About Coronavirus,Infection Through Food,Can I get infected by eating?,70,0.4465302411546112,0.5092119097702206
659,About Coronavirus,Infection Through Food,Can you get Corona from eating take away ,70,0.7243976179733852,0.5092119097702206
321,Coronavirus Recommendations,Actions If At Risk,What can I do if I am a part of an at risk group?,71,0.16248579328928123,0.24372868993392185
329,Coronavirus Recommendations,Actions If At Risk,How should I react if I'm part of the risk groups? ,71,0.4874573798678437,0.24372868993392185
722,Coronavirus Recommendations,Actions If At Risk,what should i do if i'm part of an at risk group,71,0.16248579328928123,0.24372868993392185
791,Coronavirus Recommendations,Actions If At Risk,What to do if i am a part of the risk group?,71,0.16248579328928123,0.24372868993392185
580,Coronavirus Recommendations,Illness,im sick!!! what am a supposed to do?,72,0.6486705788697423,0.4324470525798283
504,Coronavirus Recommendations,Actions If At Risk,im at risk.. what do i do,72,0.3243352894348712,0.4324470525798283
496,Coronavirus Recommendations,Not At Risk,im not at risk. what do i do,72,0.3243352894348712,0.4324470525798283
617,Coronavirus Recommendations,Postponed Surgeries,What types of surgeries have been postponed by hospitals?,73,0.3628895516939777,0.2419263677959852
762,Coronavirus Recommendations,Postponed Surgeries,What type of surgeries has been postponed?,73,0.18144477584698893,0.2419263677959852
366,Coronavirus Recommendations,Postponed Surgeries,What are the types of surgeries that has been postponed?,73,0.18144477584698893,0.2419263677959852
950,Coronavirus Recommendations,Actions At Home,How can we prevent the virus to spread in our household? ,74,0.5500824778145997,0.5615321082091427
31,Gatherings,Gathering Precautions,Is there anyhting I can do to prevent spread of the virus during my party?,74,0.5933084470366239,0.5615321082091427
921,Coronavirus Recommendations,Actions At Home,what can we do here to prevent the spread of it? at home?,74,0.5412053997762045,0.5615321082091427
886,Coronavirus Recommendations,Pet,can my bird catch the corona if i have it,75,0.5683446373843811,0.3788964249229207
701,About Coronavirus,Methods of Transmission,How do you catch Corona _,75,0.2841723186921905,0.3788964249229207
583,About Coronavirus,Infected Twice,Can you catch Corona more than once ,75,0.2841723186921905,0.3788964249229207
735,Coronavirus Recommendations,Curfew,Has been a curfew introduced already?,76,0.23634163592096194,0.236341635920962
627,Coronavirus Recommendations,Curfew,Have the authorities introduced a curfew already?,76,0.23634163592096205,0.236341635920962
64,Coronavirus Recommendations,Illness,what should I do if I feel sick?,77,0.42273666162427526,0.42273666162427526
167,About Coronavirus,Incubation Period,How long does it take for me to feel sick after I catch coronavirus?,77,0.42273666162427526,0.42273666162427526
561,About Coronavirus,Incubation Period,whats the incubation period,78,0.49568289818552863,0.4184752858111086
306,About Coronavirus,Incubation Period,What is the incubation period of COVID-19?,78,0.3983218242133657,0.4184752858111086
470,About Coronavirus,Incubation Period,What is the incubation period of Coronavirus?,78,0.33910667333145067,0.4184752858111086
672,About Coronavirus,Incubation Period,tell me about the incubation period,78,0.4407897475140895,0.4184752858111086
331,Coronavirus Recommendations,Precautions,What precautions do I need to take if I am going travelling?,79,0.40903200934143286,0.5866228062256146
238,Coronavirus Recommendations,Precautions,"i'm going travelling, do I need to take any precautions?",79,0.40903200934143286,0.5866228062256146
430,Coronavirus Recommendations,Precautions,Are there special precautions I have to take if I'm travelling abroad?,79,0.6817970855042313,0.5866228062256146
336,Coronavirus Recommendations,Not At Risk,"i don't think I'm at risk, do I need to take any precautions?",79,0.7082047096230658,0.5866228062256146
224,Coronavirus Recommendations,Precautions,what precautions should i make if travelling,79,0.72504821731791,0.5866228062256146
1012,Coronavirus Recommendations,Returning From Travel,Do I have to go into quarantine if I come back home from abroad? Is it mandatory?,80,0.0,0.0
353,Coronavirus Recommendations,Swimming Hall,"Am I exposed for infections, if i swim in a public pool",81,0.4591872560882749,0.4591872560882749
19,Coronavirus Recommendations,Swimming Hall,is it safe to use a public swimming pool?,81,0.4591872560882749,0.4591872560882749
39,Coronavirus Recommendations,Swimming Hall,is is possible to get infected with corona if i go swimming?,82,0.6523160858159978,0.4703760273746015
429,Coronavirus Recommendations,Swimming Hall,"If I go swimming, am I at risk of infection?",82,0.3831674509102037,0.4703760273746015
758,Coronavirus Recommendations,Swimming Hall,Can i get infected if i go to swimming hall?,82,0.5464469521121713,0.4703760273746015
509,Coronavirus Recommendations,Swimming Hall,am a at risk of infection if i go swimming?,82,0.3831674509102037,0.4703760273746015
328,Coronavirus Recommendations,Swimming Hall,Am I at risk of infection if I go swimming in a swimming hall?,82,0.3867821971244312,0.4703760273746015
702,About Coronavirus,What Do We Know About Coronavirus,What info about coronavirus you have?,83,0.3370854693521189,0.33708546935211897
76,Contact,Hotline,where can I find info about coronavirus? _,83,0.337085469352119,0.33708546935211897
101,Contact,Hotline,can i call a hotline,84,0.323304355825217,0.4177558214919828
689,Contact,Hotline,Where can I call?,84,0.47694497999414165,0.4177558214919828
546,Contact,Hotline,i want to call a coronavirus hotline,84,0.45301812865658997,0.4177558214919828
290,About Coronavirus,Treatment,I'm sick. how can I treat corona from home,85,0.7131092270904417,0.5568230141200353
664,About Coronavirus,Treatment,how to treat covid19,85,0.32602606652583177,0.5568230141200353
795,About Coronavirus,Treatment,How infected people with coronavirus are treated?,85,0.6383421610381366,0.5568230141200353
387,About Coronavirus,Treatment,how is the disease treated,85,0.6734091042047888,0.5568230141200353
801,About Coronavirus,Treatment,How coronavirus needs to be treated?,85,0.6062707984250786,0.5568230141200353
471,About Coronavirus,Treatment,How does the virus get treated?,85,0.6145776750301388,0.5568230141200353
234,About Coronavirus,Treatment,how is covid19 treated?,85,0.32602606652583177,0.5568230141200353
890,Coronavirus Recommendations,Children,should i send the kids to kindergarten,86,0.4092621470288794,0.4092621470288794
743,Employer Guidelines,Daycare,What to do if my employee cannot work because the kids are not having kindergarten?,86,0.4092621470288794,0.4092621470288794
568,About Coronavirus,Infection Through Food,can i get covid-19 from food,87,0.3754292328099189,0.3754292328099189
839,About Coronavirus,Infection Through Food,Can you catch COVID-19 from food?,87,0.3754292328099189,0.3754292328099189
449,About Coronavirus,Incubation Period,How long does the virus incubate?,88,0.7839776099478876,0.6438537410416596
953,About Coronavirus,Incubation Period,How long does it take to get sick?,88,0.4700595452034941,0.6438537410416596
969,About Coronavirus,Incubation Period,How long is the period from getting the virus to becoming sick?_,88,0.7029300287000946,0.6438537410416596
651,About Coronavirus,Incubation Period,How long does it take before you get sick from Corona ,88,0.5054529735357784,0.6438537410416596
201,About Coronavirus,Incubation Period,how long time does it take before i get infected until it is shown in a test?,88,0.7568485478210437,0.6438537410416596
1014,Coronavirus Recommendations,Closed Shops,What kind of shops are still allowed CODID-19?,89,0.7619589833034152,0.5997114498705823
636,Coronavirus Recommendations,Purchasing Groceries,Can I do the grocery shopping?,89,0.6117000258744251,0.5997114498705823
625,Coronavirus Recommendations,Purchasing Groceries,Am I allowed to do groceries? ,89,0.6117000258744251,0.5997114498705823
243,Coronavirus Recommendations,Purchasing Groceries,am I still allowed to go groceri shopping,89,0.41348676443006394,0.5997114498705823
855,About Coronavirus,Treatment,is there a vaccine?,90,0.0,0.0
989,Coronavirus Recommendations,Contact With Infected,What to do if someone I’ve been in contact with has corona?,91,0.4878626504744852,0.4663246894497323
761,Coronavirus Recommendations,Contact With Infected,"I was in contact with someone infected with coronavirus, what shall I do now?",91,0.4453828586695547,0.4663246894497323
739,Coronavirus Recommendations,Contact With Infected,What are recommendations for people who were in contact with someone infected with Coronavirus?,91,0.465728559205157,0.4663246894497323
847,Coronavirus Recommendations,Not At Risk,What do I have to do if I don't belong to any of the risk groups?,92,0.275178463940902,0.3669046185878693
566,Coronavirus Recommendations,Not At Risk,What can I do if I do not belong to any of risk groups,92,0.275178463940902,0.3669046185878693
300,Coronavirus Recommendations,Not At Risk,Do I have to take some special measure if I don't belong any risk group?,92,0.5503569278818039,0.3669046185878693
660,Coronavirus Recommendations,Educating Children On Coronavirus,How can explain to my girls how they should avoid infection?,93,0.6957948337798635,0.6082292719571618
1035,Coronavirus Recommendations,Educating Children On Coronavirus,What should I explain about coronavirus to my kids?,93,0.5806302738744568,0.6082292719571618
1051,About Coronavirus,What Is Coronavirus,Can you explain me what is the Corona?,93,0.5045100500139068,0.6082292719571618
394,About Coronavirus,Pandemic,Please explain what pandemic is ,93,0.6519819301604203,0.6082292719571618
285,Contact,Hotline,I want to contact with a hotline,94,0.4952134788163079,0.34198256404440547
472,Contact,Hotline,Can I contact a hotline?,94,0.20467251561010655,0.34198256404440547
1032,Contact,Hotline,Contact ,94,0.6006817945753997,0.34198256404440547
745,Contact,Hotline,How can i contact the hotline?,94,0.20467251561010655,0.34198256404440547
720,Contact,Hotline,can i contact a hotline,94,0.20467251561010655,0.34198256404440547
765,Coronavirus Recommendations,Sick Child,What to do if my child is at risk?,95,0.6791813603540567,0.5689438490659408
618,Coronavirus Recommendations,Children,is there any risk for my kids?,95,0.6815424680674247,0.5689438490659408
1042,Coronavirus Recommendations,People At Risk,Am I at risk?_,95,0.37003270903188457,0.5689438490659408
441,Coronavirus Recommendations,People At Risk,Who is at risk when it comes to coronavirus?,95,0.7439299988444534,0.5689438490659408
488,Coronavirus Recommendations,Actions If At Risk,What do I do if I am at risk ,95,0.37003270903188457,0.5689438490659408
352,About Coronavirus,How Many Infected,how many in total has been sick with corona,96,0.4340292961104877,0.43402929611048763
985,About Coronavirus,How Many Infected,How many people are sick of corona? ,96,0.4340292961104876,0.43402929611048763
641,Coronavirus Recommendations,Student,How can I find recommendations for students during Coronavirus outbreak?,97,0.30521467135729274,0.30521467135729274
380,Coronavirus Recommendations,Student,Where do I find info and recommendations for student during an outbreak?,97,0.30521467135729274,0.30521467135729274
532,Employer Guidelines,Sick Employee,what do i do if someone at work has been infected and i'm their manager,98,0.0,0.0
776,About Coronavirus,Infected Twice,Can i get infected twice?,99,0.37185300844234326,0.5005069452164459
398,About Coronavirus,Infected Twice,Is it likely to be infected twice?,99,0.5479125671639664,0.5005069452164459
829,About Coronavirus,Infected Twice,Can you catch the coronavirus twice?,99,0.678854086856527,0.5005069452164459
1043,About Coronavirus,Infected Twice,can I be infected twice?_,99,0.33665305544661495,0.5005069452164459
458,About Coronavirus,Infected Twice,Is it possible to get infected twice?,99,0.567262008172778,0.5005069452164459
347,About Coronavirus,Fear,"do I need to be scared? Trump isn't scared, why should I",100,0.5055169153301385,0.4550350045364019
200,About Coronavirus,Fear,how scared should i be for coronavirus,100,0.4055639315452547,0.4550350045364019
896,Coronavirus Recommendations,Educating Children On Coronavirus,my child is scared what do i tell him,100,0.6593119964991501,0.4550350045364019
963,About Coronavirus,Fear,Should I be scared?,100,0.27320019325665307,0.4550350045364019
448,About Coronavirus,Fear,How scared should I be of corona?,100,0.43158198605081327,0.4550350045364019
467,About Coronavirus,Treatment,Is there a treatment plan for coronavirus?,101,0.0,0.0
77,Contact,Hotline,what is the phone number for coronavirus hotline? _,102,0.3490740109553701,0.44202027510913244
47,Contact,Hotline,what's the phone number where i can find more information about corona,102,0.6199761197268627,0.44202027510913244
1004,Contact,Hotline,What is the coronavirus phone number? What is the coronavirus hotline number,102,0.3570106946451645,0.44202027510913244
941,Coronavirus Recommendations,Pregnant,I am with child and don’t know what to do ,103,0.33034974219917185,0.3303497421991719
242,Coronavirus Recommendations,Sick Child,"my child is sick, how do I know if it is corona?",103,0.3303497421991719,0.3303497421991719
151,Coronavirus Recommendations,Precautions,What do I need to do to be safe while traveling?,104,0.47269846938362586,0.6013664796550903
613,Coronavirus Recommendations,Precautions,What shall I do if I need to travel?,104,0.649480734852761,0.6013664796550903
