, Domain,intent,text,centroids_id,dist_score,avg_dist_score
718,About Coronavirus,Latest News,"latest news, please",16,0.5990073092639807,0.34908529163773794
301,About Coronavirus,Latest News,Latest news on Coronavirus,16,0.26367760340405105,0.34908529163773794
804,About Coronavirus,Latest News,What are the latest news about coronavirus?,16,0.26367760340405105,0.34908529163773794
698,About Coronavirus,Latest News,What are the latest news on Coronavirus?,16,0.26367760340405105,0.34908529163773794
389,About Coronavirus,Latest News,The latest news re the outbreak,16,0.5301380781451638,0.34908529163773794
230,About Coronavirus,Latest News,what are the latest news about covid19?,16,0.18810160208330962,0.34908529163773794
846,About Coronavirus,Latest News,what are the latest covid-19 news,16,0.4619961269550112,0.34908529163773794
1022,About Coronavirus,Mortality Rate,how many dies from it?,17,0.2721176289525523,0.5142784200138724
1023,About Coronavirus,Mortality Rate,how many dies from it?,17,0.2721176289525523,0.5142784200138724
1024,About Coronavirus,Mortality Rate,how many dies from the virus?_,17,0.4540994621913759,0.5142784200138724
6,About Coronavirus,Fear,Will I die?,17,0.6596657014120244,0.5142784200138724
858,About Coronavirus,Status,how many have died?,17,0.2721176289525523,0.5142784200138724
675,About Coronavirus,Mortality Rate,how many percent of infecet people die,17,0.8224673227846167,0.5142784200138724
864,About Coronavirus,Mortality Rate,how many have died worldwide?,17,0.6774491460179018,0.5142784200138724
708,About Coronavirus,Mortality Rate,how many die of covid19,17,0.2721176289525523,0.5142784200138724
835,About Coronavirus,Mortality Rate,how many die on average of coronavirus,17,0.7294959893778714,0.5142784200138724
565,About Coronavirus,Mortality Rate,how many die of covid-19,17,0.5249940573179362,0.5142784200138724
576,About Coronavirus,Mortality Rate,How many people die because of the virus?,17,0.5080262638423589,0.5142784200138724
771,About Coronavirus,Mortality Rate,How many people die from Coronavirus?,17,0.479964539111306,0.5142784200138724
657,About Coronavirus,Mortality Rate,How many out of a hundred people will die from Corona ,17,0.7409864623147412,0.5142784200138724
440,Coronavirus Recommendations,Pet,I've tested positive for corona. What should I do about my pet?,18,0.4008827034522623,0.5040047335117755
1026,Employer Guidelines,Sick Employee,What to do if your employee has tested positive for covid,18,0.6541295578081701,0.5040047335117755
712,About Coronavirus,How Many Infected,how many have tested positive for coronavirus,18,0.7057331269456815,0.5040047335117755
789,Coronavirus Recommendations,Pet,What to do with my pet if i am tested covid-19 positive?,18,0.356488233996344,0.5040047335117755
850,Coronavirus Recommendations,Pet,What do I do with my pet if I have tested positive for Coronavirus / COVID-19?,18,0.38223232388626627,0.5040047335117755
500,Coronavirus Recommendations,Pet,im positive. what about my pet?,18,0.7732182383751732,0.5040047335117755
486,Coronavirus Recommendations,Pet,What do I do about my pet when tested positive for Corona virus ,18,0.5034483086669425,0.5040047335117755
317,Coronavirus Recommendations,Pet,What can I do with my pet if I have tested positive for Coronavirus?,18,0.3585966216827674,0.5040047335117755
237,Coronavirus Recommendations,Pet,what do i do with my pet if I am tested positive?,18,0.3113906230375029,0.5040047335117755
1052,Coronavirus Recommendations,Contact With Infected,What do I do if my neighboor has been tested positive for COVID?,18,0.7865417077409184,0.5040047335117755
217,Coronavirus Recommendations,Pet,what do i do with my pet if i am tested positive?,18,0.3113906230375029,0.5040047335117755
905,Coronavirus Recommendations,Curfew,am i allowed out after 9?,19,0.4363710918917342,0.598707540502501
507,Coronavirus Recommendations,Curfew,Am so allowed to leave my home ,19,0.7088642939297771,0.598707540502501
931,Gatherings,Cancelling Gathering,are gatherings and meetings allowed?,19,0.6955303736092286,0.598707540502501
946,Coronavirus Recommendations,Curfew,Am I allowed to go out?,19,0.554064402579264,0.598707540502501
836,About Coronavirus,Coronavirus Versus Influenza,How does coronavirus compare to Influenza?,20,0.7240272839945121,0.6551318657189045
547,About Coronavirus,Coronavirus Versus Influenza,Are coronavirus and influenza the same virus?,20,0.5446512787898566,0.6551318657189045
67,About Coronavirus,Coronavirus Versus Influenza,are there any resemblances between coronavirus and influenza?  ,20,0.724027283994512,0.6551318657189045
450,About Coronavirus,Coronavirus Versus Influenza,Isn't corona and influenza just the same thing?,20,0.7783269318877464,0.6551318657189045
697,About Coronavirus,Coronavirus Versus Influenza,Is coronavirus equal to Influenza?,20,0.7072152338778995,0.6551318657189045
355,About Coronavirus,Coronavirus Versus Influenza,is coronavirus the same that influenza?,20,0.3927131182775197,0.6551318657189045
679,About Coronavirus,Coronavirus Versus Influenza,Is Corona similar to influenza,20,0.7783269318877464,0.6551318657189045
362,About Coronavirus,Coronavirus Versus Influenza,are Covid-19 and influenza the same?,20,0.6367461335427024,0.6551318657189045
803,About Coronavirus,Coronavirus Versus Influenza,Is coronavirus same as influenza?,20,0.3927131182775197,0.6551318657189045
1040,About Coronavirus,Coronavirus Versus Influenza,"I'm confused, I don't know if corona is related to influenza. Is it the same?",20,0.8725713426590302,0.6551318657189045
332,Coronavirus Recommendations,Pregnant,"I'm pregnant, what are my precautions?",21,0.6590657103131465,0.6064484798472957
324,Coronavirus Recommendations,Pregnant,What can I do if I am pregnant?,21,0.3456799365126444,0.6064484798472957
753,Coronavirus Recommendations,Pregnant,What to do if i am pregnant?,21,0.3456799365126444,0.6064484798472957
489,Coronavirus Recommendations,Pregnant,I am pregnant what to do to protect myself ,21,0.6159342063864639,0.6064484798472957
605,Coronavirus Recommendations,Pregnant,"I am pregnant, what shall I do to protect myself from the virus?",21,0.7669192321105351,0.6064484798472957
505,Coronavirus Recommendations,Pregnant,what do i do if im pregnant,21,0.6776553571061067,0.6064484798472957
220,Coronavirus Recommendations,Pregnant,what do i do if being pregnant?,21,0.3456799365126444,0.6064484798472957
728,Coronavirus Recommendations,Pregnant,should i take extra precautions if im pregnant,21,0.8629018517743586,0.6064484798472957
1008,Coronavirus Recommendations,Pregnant,What do I do if I’m pregnant? Is corona virus dangerous for me? ,21,0.7958344147141319,0.6064484798472957
106,Coronavirus Recommendations,Pregnant,What should I do if I am pregnant?,21,0.3456799365126444,0.6064484798472957
80,Coronavirus Recommendations,Pregnant,Should I be isolating if I am pregnant?,21,0.7918336550120316,0.6064484798472957
709,Coronavirus Recommendations,Pregnant,How should I behave if I am pregnant,21,0.7245175847001962,0.6064484798472957
592,Coronavirus Recommendations,Public Spaces,What do you recommend when taking public transport ,22,0.4160680695191198,0.4160680695191198
794,Coronavirus Recommendations,Public Transport,Is public transport working?,22,0.4160680695191198,0.4160680695191198
544,About Coronavirus,Treatment,How can the Covid 19 been treated?,23,0.0,0.0
345,About Coronavirus,Treatment,How is Covid-19 treated?,23,0.0,0.0
620,Coronavirus Recommendations,Closed Shops,What shops are closed during Coronavirus pandemic?,24,0.5580494418170723,0.4580632688657999
498,Coronavirus Recommendations,Closed Shops,What shops has been closed during the lockdown  ,24,0.5966428777585763,0.4580632688657999
517,Coronavirus Recommendations,Closed Shops,which shops are closed?,24,0.2567380032595281,0.4580632688657999
433,Coronavirus Recommendations,Closed Shops,Which shops are still closed?,24,0.49209296790794854,0.4580632688657999
241,Coronavirus Recommendations,Closed Shops,which shops are closed these days?,24,0.5881183191921459,0.4580632688657999
721,Coronavirus Recommendations,Closed Shops,which shops will close?,24,0.2567380032595281,0.4580632688657999
852,Coronavirus Recommendations,Actions If At Risk,What precautions should I take if I am part of a risk group?,25,0.0,0.0
716,About Coronavirus,Status,what is the status for the coronavirus outbreak,26,0.33716989807543396,0.33716989807543396
714,About Coronavirus,Status,what is the current status for the outbreak,26,0.33716989807543396,0.33716989807543396
501,Coronavirus Recommendations,Sick Child,What do I do if my child gets sick ,27,0.35272217803906886,0.4645298323745001
444,Coronavirus Recommendations,Sick Child,"My child is sick, should I be doing something in particular?",27,0.725019590546509,0.4645298323745001
622,Coronavirus Recommendations,Sick Child,"My child is sick, what shall I do? ",27,0.5644633132859876,0.4645298323745001
258,Coronavirus Recommendations,Sick Child,What can I do if my child is sick?,27,0.32772190196186635,0.4645298323745001
737,Coronavirus Recommendations,Sick Child,What can I do if my child gets sick?,27,0.35272217803906886,0.4645298323745001
188,Employer Guidelines,Vacation,can agreed vacation be changed if an employee cant take vacation due to coronavirus,28,0.5638777353694078,0.4776863090522456
280,Employer Guidelines,Vacation,Can an employee change vacation due to Coronavirus?,28,0.3328223387227546,0.4776863090522456
539,Employer Guidelines,Vacation,can i change my employee's vacation to now?,28,0.5069536244803163,0.4776863090522456
423,Employer Guidelines,Vacation,Can scheduled vacation be changed if an employee is prevented from taking their vacation due to travel restrictions and such?,28,0.5887281356941754,0.4776863090522456
741,Employer Guidelines,Vacation,Does my vacation will changed due to coronavirus?,28,0.38080572163545384,0.4776863090522456
409,Employer Guidelines,Vacation,Can I change my vacation schedule due to coronavirus,28,0.4929302984113657,0.4776863090522456
215,Coronavirus Recommendations,Infection Prevention,how can i prevent getting infected,29,0.3547920040953849,0.5485275542444871
40,Coronavirus Recommendations,Precautions,how can i prevent getting corona while travelling?,29,0.7286831320593314,0.5485275542444871
497,Coronavirus Recommendations,Infection Prevention,ho to prevent infection,29,0.7137000973541708,0.5485275542444871
315,Coronavirus Recommendations,Infection Prevention,How can I prevent to be infected?,29,0.38833391337343515,0.5485275542444871
55,Coronavirus Recommendations,Infection Prevention,how can I prevent getting infected with coronavirus?,29,0.4223690933620264,0.5485275542444871
616,Coronavirus Recommendations,Employer,how do i prevent my employees from getting infected,29,0.4875174040689425,0.5485275542444871
822,Coronavirus Recommendations,Actions At Home,What steps I can take at home to prevent coronavirus infection?,29,0.7604644834837925,0.5485275542444871
527,Coronavirus Recommendations,Actions At Home,what can i do at home to prevent being infected,29,0.5323603061588131,0.5485275542444871
391,Coronavirus Recommendations,Public Spaces,What are the recommendations for entering a public space?,30,0.580685783274062,0.5591162077908979
481,Coronavirus Recommendations,Public Spaces,How should I behave in the public space?,30,0.5288132320413307,0.5591162077908979
461,Coronavirus Recommendations,Public Spaces,Should I be doing anything in particular when I'm in public spaces?,30,0.5678496080573011,0.5591162077908979
320,Coronavirus Recommendations,Infection Prevention,Please tell me how I can avoid infection?,31,0.7384941035368354,0.6631783925160887
859,About Coronavirus,Strategy,should i avoid people?,31,0.566417024315132,0.6631783925160887
484,Coronavirus Recommendations,Infection Prevention,How do I best avoid to be infected ,31,0.7136134077005578,0.6631783925160887
848,Coronavirus Recommendations,Infection Prevention,What guidelines do I have to follow to avoid being infected?,31,0.7851240381326321,0.6631783925160887
967,Coronavirus Recommendations,Public Spaces,Should I avoid people when I am outside? ,31,0.7134341791715837,0.6631783925160887
35,Coronavirus Recommendations,Actions If At Risk,who should I avoid to not get corona?,31,0.6614225499990802,0.6631783925160887
15,Coronavirus Recommendations,Infection Prevention,how can I avoid being infected?,31,0.46374344475679935,0.6631783925160887
857,About Coronavirus,Latest News,did the government close the borders?,32,0.0,0.0
962,About Coronavirus,Testing,Should I get my grandfather tested?,33,0.7212972918136377,0.47889504629375873
912,About Coronavirus,Testing,should everyone get tested,33,0.7020066230112614,0.47889504629375873
228,About Coronavirus,Testing,who should get a test?,33,0.27501822446786295,0.47889504629375873
878,Coronavirus Recommendations,Doctor,should i get tested for corona? ,33,0.46480571240462676,0.47889504629375873
330,About Coronavirus,Testing,who should get tested,33,0.27501822446786295,0.47889504629375873
977,About Coronavirus,Testing,Who gets tested for the coronavirus?,33,0.4352242015973008,0.47889504629375873
944,Coronavirus Recommendations,Sick Child,My kid may be sick from corona. What should I do?,34,0.5645135310152305,0.37634235401015365
519,Coronavirus Recommendations,Sick Child,my kid is sick.. what should i do,34,0.2822567655076153,0.37634235401015365
176,Coronavirus Recommendations,Sick Child,what do i do if my kid is sick,34,0.2822567655076153,0.37634235401015365
490,Coronavirus Recommendations,Children,Is children especially at risk catching Corona ,35,0.4503229211426274,0.48944203090546806
487,Coronavirus Recommendations,People At Risk,Who is especially at risk for catching Corona and get ill ,35,0.47576418434759904,0.48944203090546806
319,Coronavirus Recommendations,People At Risk,Who are especially at risk of infection?,35,0.5422389872261778,0.48944203090546806
359,About Coronavirus,What Do We Know About Coronavirus,what do we know about Covid-19?,36,0.27744153244940967,0.36992204326587946
652,About Coronavirus,What Do We Know About Coronavirus,what do we know abt covid-19,36,0.5548830648988191,0.36992204326587946
809,About Coronavirus,What Do We Know About Coronavirus,What do you know about covid-19?,36,0.27744153244940967,0.36992204326587946
58,About Coronavirus,Status,what's the current status of covid 19? ,37,0.31264845145239284,0.31264845145239284
108,About Coronavirus,Status,Status of COVID-19,37,0.3126484514523929,0.31264845145239284
677,Coronavirus Recommendations,Pet,can i take care of my pet if i get coronavirus,38,0.6655412821553145,0.3327706410776573
477,About Coronavirus,Infection Of Pets,Can pets get infected with Coronavirus?,38,0.2218470940517715,0.3327706410776573
775,About Coronavirus,Infection Of Pets,Can pets get infected by coronavirus?,38,0.2218470940517715,0.3327706410776573
310,About Coronavirus,Infection Of Pets,Can my pet get infected by Coronavirus?,38,0.2218470940517715,0.3327706410776573
426,Contact,Hotline,I'd like to contact the coronavirus hotline,39,0.0,0.0
295,Coronavirus Recommendations,Employer,What can I do to protect my employees?,40,0.21155581664505654,0.3797556643219718
840,Coronavirus Recommendations,Employer,What are the steps to protect employees during coronavirus?,40,0.6973043138241681,0.3797556643219718
624,Coronavirus Recommendations,Employer,What do I do to protect my employees from Corona ,40,0.4257636355773843,0.3797556643219718
604,Coronavirus Recommendations,Infection Prevention,How can I protect myself?,40,0.5207985865951089,0.3797556643219718
435,Coronavirus Recommendations,Employer,What can I do to protect my employees?,40,0.21155581664505654,0.3797556643219718
782,Coronavirus Recommendations,Employer,How can i protect my employees?,40,0.21155581664505654,0.3797556643219718
766,About Coronavirus,What Is Coronavirus,What does coronavirus mean?,41,0.5718947351222466,0.4596787887066475
346,About Coronavirus,Pandemic,What does pandemic mean?,41,0.28938541706506976,0.4596787887066475
763,About Coronavirus,Pandemic,What a pandemic mean?,41,0.28938541706506976,0.4596787887066475
168,About Coronavirus,Pandemic,What does it mean when it says pandemic?,41,0.5477916380476621,0.4596787887066475
863,About Coronavirus,Pandemic,pnademic what does it mean,41,0.7702301078747672,0.4596787887066475
655,About Coronavirus,Pandemic,What does pandemic means ,41,0.28938541706506976,0.4596787887066475
401,Coronavirus Recommendations,Health Authority Recommendations,What is the recommendations of the Board of Health?,42,0.8239701441867824,0.4656229002857259
112,Coronavirus Recommendations,Health Authority Recommendations,What are the recommendations of our health authorities?,42,0.20899926554677115,0.4656229002857259
480,Coronavirus Recommendations,Health Authority Recommendations,What are the recommendations of Health Authority?,42,0.20899926554677115,0.4656229002857259
986,Coronavirus Recommendations,Health Authority Recommendations,What are the health recommendations for coronavirus?,42,0.6634890454385499,0.4656229002857259
778,Coronavirus Recommendations,Health Authority Recommendations,What Health authorities recommends?,42,0.20899926554677115,0.4656229002857259
338,Coronavirus Recommendations,Health Authority Recommendations,what do the health authorities command,42,0.7496913512898222,0.4656229002857259
208,Coronavirus Recommendations,Health Authority Recommendations,what are the recommendations by the authorities,42,0.6503489314172148,0.4656229002857259
460,Coronavirus Recommendations,Health Authority Recommendations,What does the health authority recommend?,42,0.20899926554677115,0.4656229002857259
575,Coronavirus Recommendations,Health Authority Recommendations,what does the health authority reccomend,42,0.7237332027910338,0.4656229002857259
314,Coronavirus Recommendations,Health Authority Recommendations,What are the Health Authority recommendations?,42,0.20899926554677115,0.4656229002857259
263,Coronavirus Recommendations,Visiting Elderly,Can I visit elderly people?,43,0.3867921548086766,0.54962500213923
643,Coronavirus Recommendations,Visiting Elderly,Can I visit my elders?,43,0.4127281380106926,0.54962500213923
180,Coronavirus Recommendations,Visiting Elderly,can i still visit elderly in their home ,43,0.5118106026413219,0.54962500213923
876,Coronavirus Recommendations,Visiting Elderly,can i still visit elderly family,43,0.6487440229933457,0.54962500213923
827,Coronavirus Recommendations,Visiting Elderly,Are visits to homes of elderly people or care houses banned?,43,0.7267552341473399,0.54962500213923
632,Coronavirus Recommendations,Visiting Elderly,Is it safe to visit elderly people in their homes or carehouses?,43,0.6683082805494157,0.54962500213923
793,Coronavirus Recommendations,Visiting Elderly,Can i go to visit elderly people?,43,0.49223658182381713,0.54962500213923
376,Employer Guidelines,Quarantine,"What do I do as an employer, when one of my employees is in quarantine",44,0.5195561102339596,0.5805387797008242
685,Employer Guidelines,Quarantine,What is the procedure if one of my employees is under quarantine? ,44,0.5890610350316033,0.5805387797008242
688,Employer Guidelines,Quarantine,One of my employees is lockdown under quarantine. How do I manage the situation?,44,0.7162079266902631,0.5805387797008242
727,Employer Guidelines,Quarantine,one of my employees have been put inder quarantine. now what,44,0.6990915208803623,0.5805387797008242
284,Employer Guidelines,Quarantine,What can I do if one of my employees is under quarantine?,44,0.37877730566793305,0.5805387797008242
607,Coronavirus Recommendations,Children,Are children at higher risk of Coronavirus?,45,0.6602356972914938,0.26409427891659754
107,Coronavirus Recommendations,Children,Are children at risk from this?,45,0.16505892432287345,0.26409427891659754
325,Coronavirus Recommendations,Children,are children at risk?,45,0.16505892432287345,0.26409427891659754
81,Coronavirus Recommendations,Children,What is the risk to my children?,45,0.16505892432287345,0.26409427891659754
756,Coronavirus Recommendations,Children,Does my children are in risk?,45,0.16505892432287345,0.26409427891659754
313,About Coronavirus,How Many Infected,How many have been infected by Coronavirus?,46,0.44487609358156366,0.5902441864168313
777,About Coronavirus,How Many Infected,How many people have been infected with Coronavirus?,46,0.43362558902667164,0.5902441864168313
207,About Coronavirus,How Many Infected,how many people are infected with coronvirus ,46,0.706102605592161,0.5902441864168313
586,About Coronavirus,How Many Infected,How many people are infected by Corona in Denmark ,46,0.6874824312247614,0.5902441864168313
400,About Coronavirus,How Many Infected,How many has been infected by the corona?,46,0.5317908470055794,0.5902441864168313
574,About Coronavirus,How Many Infected,how many have had coronavirus,46,0.6108968630571796,0.5902441864168313
747,Gatherings,Arranging Gathering,What to do if i am organising a gathering of many people?,46,0.8620391131916556,0.5902441864168313
837,About Coronavirus,How Many Infected,how many infected?,46,0.4451399486550781,0.5902441864168313
157,Coronavirus Recommendations,Curfew,When is curfew?,47,0.19762586087906392,0.3820946576134278
768,Coronavirus Recommendations,Curfew,Is there a curfew now?,47,0.19762586087906392,0.3820946576134278
680,Coronavirus Recommendations,Curfew,is there currently a curfew,47,0.6358843163484443,0.3820946576134278
178,Coronavirus Recommendations,Curfew,is there a curfew,47,0.19762586087906392,0.3820946576134278
474,Coronavirus Recommendations,Curfew,Is there a curfew?,47,0.19762586087906392,0.3820946576134278
370,Coronavirus Recommendations,Curfew,Has the curfew been set in place?,47,0.8777150263688737,0.3820946576134278
917,Coronavirus Recommendations,Curfew,are we allowed to go out there? is there any curfew?,47,0.7394974105291484,0.3820946576134278
521,Coronavirus Recommendations,Curfew,is there a curfew,47,0.19762586087906392,0.3820946576134278
802,Coronavirus Recommendations,Curfew,Is a curfew on?,47,0.19762586087906392,0.3820946576134278
98,Employer Guidelines,Vacation,yes,48,0.1846185603096351,0.29538969649541613
148,Coronavirus Recommendations,Student,yes,48,0.1846185603096351,0.29538969649541613
92,Coronavirus Recommendations,Swimming Hall,yes,48,0.1846185603096351,0.29538969649541613
90,Coronavirus Recommendations,Children,"yes, as their parents WILL die",48,0.7384742412385403,0.29538969649541613
120,Coronavirus Recommendations,Contact With Infected,Yes,48,0.1846185603096351,0.29538969649541613
516,Coronavirus Recommendations,Postponed Surgeries,what kinds of surgeries are being postponed,49,0.384874274144544,0.5928375761382866
194,Coronavirus Recommendations,Postponed Surgeries,what kind of surgery is being postponed,49,0.384874274144544,0.5928375761382866
432,Coronavirus Recommendations,Postponed Surgeries,"I was scheduled to have rhinoplasty, are those kinds of surgeries postponed?",49,0.6577871396692185,0.5928375761382866
337,Coronavirus Recommendations,Postponed Surgeries,I would like to know which surgeries have been postponed,49,0.7591963361262343,0.5928375761382866
820,Coronavirus Recommendations,Postponed Surgeries,What surgeries are postponed because of coronavirus?,49,0.5320050586691217,0.5928375761382866
1029,Employer Guidelines,Vacation,Can i postpone my vacation,49,0.8418031278972263,0.5928375761382866
798,Coronavirus Recommendations,Postponed Surgeries,What kinds of surgeries are postponed for the future?,49,0.589322822317117,0.5928375761382866
226,Coronavirus Recommendations,Returning From Travel,what do I do if i am returning from abroad?,50,0.23149506556690627,0.2314950655669063
334,Coronavirus Recommendations,Returning From Travel,What can I do if I am returning from travelling abroad?,50,0.23149506556690633,0.2314950655669063
526,Coronavirus Recommendations,Public Transport,what should i do if i use public transportation,51,0.2503044315927277,0.4342249089794913
247,Coronavirus Recommendations,Public Transport,is it a bad idea to use public transport,51,0.6716794909309016,0.4342249089794913
513,Coronavirus Recommendations,Public Transport,Can I use public transport ,51,0.2503044315927277,0.4342249089794913
792,Coronavirus Recommendations,Public Transport,Can I use public transportation during the coronavirus outbreak?,51,0.43172634054187037,0.4342249089794913
417,Coronavirus Recommendations,Public Transport,Is it fine if I use public transport?,51,0.5717385390653472,0.4342249089794913
373,Coronavirus Recommendations,Public Transport,How can public transportation be used during the outbreak?,51,0.38593946780460403,0.4342249089794913
1049,Coronavirus Recommendations,Public Transport,What are the rules for using the public transport?,51,0.4778816613282606,0.4342249089794913
146,About Coronavirus,Fear,really much,52,0.5767581204470225,0.5766027629137273
935,Coronavirus Recommendations,Illness,"I have some symptoms, how do I really know if I've got it?",52,0.6317279630452194,0.5766027629137273
609,Coronavirus Recommendations,People At Risk,Who are really at risk?,52,0.5213222052489399,0.5766027629137273
562,Coronavirus Recommendations,Citizen,"I want to be a good citizen, what can I do to limit the spread of the virus",53,0.490842358631347,0.49084235863134695
335,Coronavirus Recommendations,Citizen,what can I do as a citizen to avoid spreading the virus,53,0.4908423586313469,0.49084235863134695
281,Coronavirus Recommendations,Citizen,How can I as a citizen do to minimize the spread of corona virus?,54,0.5448526499070746,0.37471650656168204
296,Coronavirus Recommendations,Citizen,How can I minimize the spread of Coronavirus?,54,0.3093479614641987,0.37471650656168204
