, Domain,intent,text,centroids_id,dist_score,avg_dist_score
694,About Coronavirus,Methods of Transmission,How coronavirus transmits from person to person?,22,0.7890179894798046,0.4662109136850037
542,About Coronavirus,Methods of Transmission,How is the coronavirus transmitted?,22,0.293908995142406,0.4662109136850037
811,About Coronavirus,Methods of Transmission,How can coronavirus be transmitted?,22,0.293908995142406,0.4662109136850037
343,About Coronavirus,Methods of Transmission,How is Coronavirus transmitted?,22,0.293908995142406,0.4662109136850037
466,About Coronavirus,Methods of Transmission,How does the virus get transmitted?,22,0.6115173408488999,0.4662109136850037
386,About Coronavirus,Methods of Transmission,How is the disease transmitted?,22,0.6430193384478561,0.4662109136850037
656,About Coronavirus,Methods of Transmission,how is it transmitted,22,0.33819474159124746,0.4662109136850037
645,Employer Guidelines,Refusal To Work,"What are my rights, if one of my employees refuses to come to work because of coronavirus?",23,0.5293251664022103,0.5835286285560011
186,Employer Guidelines,Refusal To Work,what can i do as an employer if one of my staff refuses to go to work,23,0.7138998116486308,0.5835286285560011
650,Employer Guidelines,Refusal To Travel,Does en employee have a right to refuse to travel for work?,23,0.476154804652065,0.5835286285560011
252,Employer Guidelines,Refusal To Work,"one of my employees are refusing to work due to fear of getting sick, can I fire him?",23,0.6875689009384508,0.5835286285560011
533,Employer Guidelines,Refusal To Work,what can i do if an employee is refusing to work,23,0.4364802504150108,0.5835286285560011
382,Employer Guidelines,Refusal To Work,"I'm employer. What is my rights, when an employee refuses to work due to the outbreak?",23,0.6117376027983373,0.5835286285560011
273,Employer Guidelines,Refusal To Work,What can I do if one of my employees is refusing to work due to COVID-19?,23,0.5671403224721816,0.5835286285560011
253,Employer Guidelines,Refusal To Travel,"one of my guys refuses to go abroad, can he refuse to do that?",23,0.7018455532729002,0.5835286285560011
528,Employer Guidelines,Refusal To Work,What can I do if my employees refuses to work during lockdown ,23,0.6670182094199091,0.5835286285560011
23,Employer Guidelines,Refusal To Work,what are my rights when an employee refuses to work because of the virus?,23,0.5184134528260358,0.5835286285560011
42,Employer Guidelines,Refusal To Work,does my employees have the right to refuse working because of COVID 19,23,0.5092308392702796,0.5835286285560011
478,About Coronavirus,Infected Twice,Can I get infected more than once with coronavirus?,24,0.41511470792523975,0.49516196858679884
638,Coronavirus Recommendations,Actions At Home,What can I do at home not to get infected?,24,0.6013678089290758,0.49516196858679884
786,Coronavirus Recommendations,Infection Prevention,What can i do to not get infected?,24,0.23487330783851654,0.49516196858679884
571,About Coronavirus,Infected Twice,can people get infected again,24,0.5814804189413684,0.49516196858679884
147,About Coronavirus,Methods of Transmission,how do i get it?,24,0.7292013387067859,0.49516196858679884
69,About Coronavirus,Methods of Transmission,how can i get infected with Coronavirus? ,24,0.41511470792523975,0.49516196858679884
676,About Coronavirus,Methods of Transmission,How do you get infected by Corona ,24,0.5175667025863325,0.49516196858679884
311,About Coronavirus,Infected Twice,Can I get infected more than once?,24,0.23487330783851654,0.49516196858679884
1046,About Coronavirus,Infected Twice,can I be infected again?_,24,0.7268654165901144,0.49516196858679884
757,Coronavirus Recommendations,Mask,Should i wear a mask?,25,0.31899537341320056,0.5216225803440119
428,Coronavirus Recommendations,Mask,"I see everyone wearing masks nowadays, is that something I should be doing?",25,0.5608691916041457,0.5216225803440119
326,Coronavirus Recommendations,Mask,should I be wearing a mask?,25,0.31899537341320056,0.5216225803440119
18,Coronavirus Recommendations,Mask,should I be wearing a mask when I am outside?,25,0.615573824663277,0.5216225803440119
993,Coronavirus Recommendations,Infection Prevention,Do I need to wear a mask? How often should I wash my hands?,25,0.7159630067454664,0.5216225803440119
38,Coronavirus Recommendations,Mask,should I wear a mask every time I go out?,25,0.625192026051374,0.5216225803440119
233,Coronavirus Recommendations,Mask,is it really necessary to wear a mask?,25,0.551022374652344,0.5216225803440119
870,Coronavirus Recommendations,Public Spaces,should i wear mask and gloves,25,0.17443516149948635,0.5216225803440119
348,Coronavirus Recommendations,Mask,Do I need to wear a mask?,25,0.5065381653266714,0.5216225803440119
508,Coronavirus Recommendations,Mask,am i supposed to wear a mask,25,0.5487969305004188,0.5216225803440119
491,Coronavirus Recommendations,Mask,Do I have to wear a mask to avoid catching Corona ,25,0.7054679282213975,0.5216225803440119
82,Coronavirus Recommendations,Mask,Should we be wearing N95 masks to protect us?,25,0.5256748034265233,0.5216225803440119
891,Coronavirus Recommendations,Mask,is the mask effective,25,0.820900034390669,0.5216225803440119
222,Coronavirus Recommendations,Mask,am i supposed to wear a mask?,25,0.5487969305004188,0.5216225803440119
610,Coronavirus Recommendations,Mask,Shall I wear a face mask in the public places?,25,0.6340101635323631,0.5216225803440119
619,Coronavirus Recommendations,Mask,Must a wear a mask?,25,0.17472999756323404,0.5216225803440119
341,Coronavirus Recommendations,Closed Shops,Which kinds of shops are closed due to Coronavirus?,26,0.5986049083225202,0.4774713862337479
498,Coronavirus Recommendations,Closed Shops,What shops has been closed during the lockdown  ,26,0.6142823586443118,0.4774713862337479
721,Coronavirus Recommendations,Closed Shops,which shops will close?,26,0.2869113909082051,0.4774713862337479
241,Coronavirus Recommendations,Closed Shops,which shops are closed these days?,26,0.49127396677413576,0.4774713862337479
517,Coronavirus Recommendations,Closed Shops,which shops are closed?,26,0.2869113909082051,0.4774713862337479
620,Coronavirus Recommendations,Closed Shops,What shops are closed during Coronavirus pandemic?,26,0.5785460977223386,0.4774713862337479
433,Coronavirus Recommendations,Closed Shops,Which shops are still closed?,26,0.5106765997591358,0.4774713862337479
367,Coronavirus Recommendations,Closed Shops,Which shops are closed due to the corona?,26,0.4650178815324399,0.4774713862337479
764,Coronavirus Recommendations,Closed Shops,Which shops are closed due to corona?,26,0.4650178815324399,0.4774713862337479
456,About Coronavirus,Strategy,What is the government's current strategy regarding Coronavirus?,27,0.23898128894999957,0.38490843887778886
796,About Coronavirus,Strategy,What is the strategy against coronavirus?,27,0.5353722427987158,0.38490843887778886
446,About Coronavirus,Strategy,Is there a current strategy from the government?,27,0.38037178488465134,0.38490843887778886
236,Coronavirus Recommendations,Swimming Hall,If I swim in a public swimming pool am I then puttingmyself at risk,28,0.26351024445083426,0.42681592594360246
892,Coronavirus Recommendations,Swimming Hall,but i like to swim in the pool,28,0.5134294478155558,0.42681592594360246
223,Coronavirus Recommendations,Swimming Hall,am I at risk to get infected swimming in a public pool?,28,0.4414783907207653,0.42681592594360246
364,Coronavirus Recommendations,Swimming Hall,i usually swim in a indoor swimming pool. Am I at risk,28,0.2716274031025721,0.42681592594360246
621,Coronavirus Recommendations,Swimming Hall,Is it risky to go to a swimming pool?,28,0.4670882485533583,0.42681592594360246
19,Coronavirus Recommendations,Swimming Hall,is it safe to use a public swimming pool?,28,0.5973501084674688,0.42681592594360246
150,Coronavirus Recommendations,Swimming Hall,Am I at risk for Corona at a swimming pool?,28,0.4706090230060407,0.42681592594360246
353,Coronavirus Recommendations,Swimming Hall,"Am I exposed for infections, if i swim in a public pool",28,0.35620554383982916,0.42681592594360246
611,Coronavirus Recommendations,Swimming Hall,Can I get infected in the swimming pool?,28,0.4600449235359983,0.42681592594360246
590,Coronavirus Recommendations,Health Authority Recommendations,What isPublic Health Service recommendation ,29,0.4833564824835684,0.38707359325292073
778,Coronavirus Recommendations,Health Authority Recommendations,What Health authorities recommends?,29,0.21492159970940466,0.38707359325292073
112,Coronavirus Recommendations,Health Authority Recommendations,What are the recommendations of our health authorities?,29,0.21492159970940466,0.38707359325292073
575,Coronavirus Recommendations,Health Authority Recommendations,what does the health authority reccomend,29,0.5613597878438165,0.38707359325292073
338,Coronavirus Recommendations,Health Authority Recommendations,what do the health authorities command,29,0.4480261863807911,0.38707359325292073
314,Coronavirus Recommendations,Health Authority Recommendations,What are the Health Authority recommendations?,29,0.21492159970940466,0.38707359325292073
401,Coronavirus Recommendations,Health Authority Recommendations,What is the recommendations of the Board of Health?,29,0.416566165911757,0.38707359325292073
986,Coronavirus Recommendations,Health Authority Recommendations,What are the health recommendations for coronavirus?,29,0.514012064877513,0.38707359325292073
480,Coronavirus Recommendations,Health Authority Recommendations,What are the recommendations of Health Authority?,29,0.21492159970940466,0.38707359325292073
62,Coronavirus Recommendations,Health Authority Recommendations,what are the heath authorities recommendations in denmark? ,29,0.7628363388467471,0.38707359325292073
460,Coronavirus Recommendations,Health Authority Recommendations,What does the health authority recommend?,29,0.21492159970940466,0.38707359325292073
208,Coronavirus Recommendations,Health Authority Recommendations,what are the recommendations by the authorities,29,0.38411809414383274,0.38707359325292073
74,About Coronavirus,Symptoms,what are coronavirus symptoms? _,30,0.410463072908157,0.5309356331234324
671,About Coronavirus,Symptoms,What symptoms do you have when infected with Corona ,30,0.61841031124252,0.5309356331234324
653,About Coronavirus,Symptoms,what the symptoms of the virus,30,0.5828869121657402,0.5309356331234324
699,About Coronavirus,Symptoms,What are the main symptoms of coronavirus?,30,0.2979293156822569,0.5309356331234324
322,Coronavirus Recommendations,Doctor,What symptoms should I have before I visit my doctor?,30,0.7583292571106062,0.5309356331234324
385,About Coronavirus,Symptoms,"If I am infected by the virus, which symptoms will I then experience?",30,0.4854985156601121,0.5309356331234324
955,About Coronavirus,Symptoms,What symptoms are there?,30,0.3666804988118988,0.5309356331234324
68,About Coronavirus,Symptoms,what are symptoms of coronavirus infection? ,30,0.4999714584124189,0.5309356331234324
540,About Coronavirus,Symptoms,What are the symptoms of having the disease? ,30,0.7159668993365867,0.5309356331234324
742,About Coronavirus,Symptoms,Where can I find a list of coronavirus symptoms?,30,0.5964339077713036,0.5309356331234324
810,About Coronavirus,Symptoms,What are the symptoms of coronavirus?,30,0.410463072908157,0.5309356331234324
591,Coronavirus Recommendations,Illness,What should I do if I feel symptoms?,30,0.746458988810893,0.5309356331234324
935,Coronavirus Recommendations,Illness,"I have some symptoms, how do I really know if I've got it?",30,0.8588246676680452,0.5309356331234324
350,About Coronavirus,Symptoms,What are the symptoms for Coronavirus?,30,0.410463072908157,0.5309356331234324
464,About Coronavirus,Symptoms,What are the symptoms of a nCov infection?,30,0.36950967976616683,0.5309356331234324
283,About Coronavirus,Symptoms,what are the symptoms ,30,0.3666804988118988,0.5309356331234324
741,Employer Guidelines,Vacation,Does my vacation will changed due to coronavirus?,31,0.5354212606798933,0.5774087145509774
384,Employer Guidelines,Vacation,"An employee had planned her vacation, but she is not able to fulfill it due to the current corona situation. Can it be changed or rescheduled? ",31,0.6229609970825791,0.5774087145509774
1029,Employer Guidelines,Vacation,Can i postpone my vacation,31,0.6439047314269258,0.5774087145509774
25,Employer Guidelines,Vacation,can we reschedule a vacation for an employee due to the corona virus?,31,0.5843834287433896,0.5774087145509774
188,Employer Guidelines,Vacation,can agreed vacation be changed if an employee cant take vacation due to coronavirus,31,0.32742444283609234,0.5774087145509774
1001,Employer Guidelines,Vacation,What are the vacation rules about the corona for companies?,31,0.7656641008744892,0.5774087145509774
44,Employer Guidelines,Vacation,can my employees reschedule their vacation because of covid 19?,31,0.5769862812643461,0.5774087145509774
409,Employer Guidelines,Vacation,Can I change my vacation schedule due to coronavirus,31,0.5482044595996245,0.5774087145509774
1027,Employer Guidelines,Refusal To Work,Recommendations for forcing employees for take vacation during covid ,31,0.7772108395558935,0.5774087145509774
280,Employer Guidelines,Vacation,Can an employee change vacation due to Coronavirus?,31,0.46772262623869193,0.5774087145509774
539,Employer Guidelines,Vacation,can i change my employee's vacation to now?,31,0.45892253929295407,0.5774087145509774
927,Employer Guidelines,Vacation,can employees re-schedule scheduled vacation?,31,0.72469143297633,0.5774087145509774
658,Employer Guidelines,Vacation,Can my employee changed already scheduled vacation because of coronavirus,31,0.5793799656029844,0.5774087145509774
423,Employer Guidelines,Vacation,Can scheduled vacation be changed if an employee is prevented from taking their vacation due to travel restrictions and such?,31,0.47084489753948944,0.5774087145509774
695,About Coronavirus,Treatment,What is the treatment for coronavirus?,32,0.19552907072693335,0.2917905655312387
467,About Coronavirus,Treatment,Is there a treatment plan for coronavirus?,32,0.3416340924027259,0.2917905655312387
942,Coronavirus Recommendations,Postponed Surgeries,Has cancer treatment been postponed?,32,0.4344700282683621,0.2917905655312387
70,About Coronavirus,Treatment,is there a treatment for coronavirus,32,0.19552907072693335,0.2917905655312387
646,About Coronavirus,Fear,How afraid do I have to be for the Corona virus ,33,0.5265000993797585,0.4239537031010399
305,About Coronavirus,Fear,How afraid should I be of Coronavirus?,33,0.3929950008139078,0.4239537031010399
405,About Coronavirus,Fear,Do I need to be afraid of the outbreak?,33,0.6226260910931253,0.4239537031010399
560,About Coronavirus,Fear,how afraid should i be,33,0.2659799671072914,0.4239537031010399
567,About Coronavirus,Fear,Should I be afraid of the pandemia?,33,0.31166735711111654,0.4239537031010399
720,Contact,Hotline,can i contact a hotline,34,0.2982595521600606,0.4645469328115002
686,Contact,Hotline,What is coronavirus hotline?,34,0.624398396047127,0.4645469328115002
377,Contact,Hotline,I have the need for a hotline,34,0.7345457114550568,0.4645469328115002
472,Contact,Hotline,Can I contact a hotline?,34,0.2982595521600606,0.4645469328115002
745,Contact,Hotline,How can i contact the hotline?,34,0.2982595521600606,0.4645469328115002
426,Contact,Hotline,I'd like to contact the coronavirus hotline,34,0.4887658302965315,0.4645469328115002
285,Contact,Hotline,I want to contact with a hotline,34,0.5093399354016044,0.4645469328115002
690,Gatherings,Cancelling Gathering,What are reasons behind the government's decision to cancel gathering of people?,35,0.4577144374256422,0.6421094870433885
48,Gatherings,Cancelling Gathering,what are the government recommendation in denmark? ,35,0.691640655387958,0.6421094870433885
932,Gatherings,Arranging Gathering,what are the recommended actions to organize a gathering?,35,0.836651313547244,0.6421094870433885
548,Gatherings,Cancelling Gathering,why are gatherings being cancelled,35,0.8158270493970656,0.6421094870433885
588,Coronavirus Recommendations,Health Authority Recommendations,What are the recommendations?,35,0.7927923247562495,0.6421094870433885
287,Gatherings,Cancelling Gathering,Why does the government recommend cancelling gatherings of people?,35,0.4690725680116142,0.6421094870433885
410,Gatherings,Cancelling Gathering,What's that about the government recommending the cancellation of gatherings?,35,0.44875299510565697,0.6421094870433885
1033,Gatherings,Cancelling Gathering,Why does the government ban gatherings,35,0.5814153859896248,0.6421094870433885
970,Gatherings,Cancelling Gathering,Why does the government recommend to avoid large groups of people? ,35,0.6592242894680596,0.6421094870433885
32,Coronavirus Recommendations,Health Authority Recommendations,what is the government recommending?,35,0.5845979532051593,0.6421094870433885
267,Gatherings,Cancelling Gathering,Why is it recommended that larger group meetings are cancelled?,35,0.7844264489675432,0.6421094870433885
869,Coronavirus Recommendations,Health Authority Recommendations,what does the government recommend to do?,35,0.5845979532051593,0.6421094870433885
746,Gatherings,Cancelling Gathering,Why government is cancelling social activities?,35,0.5484031541387007,0.6421094870433885
261,Gatherings,Cancelling Gathering,what is the point of the government not allowing big gatherings over 50 when 49 people is bad enough?,35,0.7344162900017641,0.6421094870433885
52,Coronavirus Recommendations,Employer,what is the employer supposed to do to protect the employees? ,36,0.4863386284325687,0.494789827325533
190,Employer Guidelines,Quarantine,what do i do as an employer if one of staff is in querantine,36,0.6791437925079294,0.494789827325533
185,Employer Guidelines,Sick Employee,what do i do as an employer if an employee is infected,36,0.5986615064020656,0.494789827325533
212,Coronavirus Recommendations,Employer,how do I as an employer protect my staff,36,0.4724856341177242,0.494789827325533
378,Coronavirus Recommendations,Employer,I am an employer. How do I protect my employees?,36,0.355625970404086,0.494789827325533
381,Employer Guidelines,Sick Employee,What of my employees (I'm the employer) has been affected by the virus. What to do?,36,0.5240984879032354,0.494789827325533
73,Coronavirus Recommendations,Employer,what is the employer supposed to do to protect the employees? ,36,0.4863386284325687,0.494789827325533
556,Coronavirus Recommendations,Employer,If I am an employer how can I protect my employees? ,36,0.355625970404086,0.494789827325533
281,Coronavirus Recommendations,Citizen,How can I as a citizen do to minimize the spread of corona virus?,37,0.39522003700672526,0.3165367411630003
482,Coronavirus Recommendations,Citizen,How do I minimize the spread of Coronavirus,37,0.28305143645251585,0.3165367411630003
648,Coronavirus Recommendations,Citizen,what can i do to minimize spreading the virus,37,0.30482405474024415,0.3165367411630003
296,Coronavirus Recommendations,Citizen,How can I minimize the spread of Coronavirus?,37,0.28305143645251585,0.3165367411630003
356,Coronavirus Recommendations,Precautions,"I should I behave, if I'm travelling?",38,0.6248083771970125,0.47572210140665866
589,Coronavirus Recommendations,Public Spaces,How should I behave in public?,38,0.28808436158685813,0.47572210140665866
113,Coronavirus Recommendations,Public Spaces,How should I behave when I’m with other people in public?,38,0.42650109193756763,0.47572210140665866
481,Coronavirus Recommendations,Public Spaces,How should I behave in the public space?,38,0.39767875609956893,0.47572210140665866
209,Coronavirus Recommendations,Public Spaces,i would like to get recommendations on how to behave in the public,38,0.6415379202122856,0.47572210140665866
77,Contact,Hotline,what is the phone number for coronavirus hotline? _,39,0.5552508881245527,0.6147100952759493
930,Contact,Hotline,please provide me with a number for a hotline of someone I can talk to,39,0.7730875012445663,0.6147100952759493
118,About Coronavirus,Latest News,What is total number of deaths due to Corona virus?,39,0.6876439192645394,0.6147100952759493
1004,Contact,Hotline,What is the coronavirus phone number? What is the coronavirus hotline number,39,0.5228522583457521,0.6147100952759493
119,About Coronavirus,Status,Which country has the most number of casualties due to Corona virus?,39,0.6433621544975382,0.6147100952759493
57,About Coronavirus,Latest News,what is the current number of cases in the world?,39,0.48341864094540227,0.6147100952759493
459,About Coronavirus,How Many Infected,What's the current number of infected people?,39,0.6291008001543982,0.6147100952759493
882,Contact,Hotline,is there a number for questions,39,0.6295493868683391,0.6147100952759493
47,Contact,Hotline,what's the phone number where i can find more information about corona,39,0.6338625415720403,0.6147100952759493
824,About Coronavirus,How Many Infected,What is the current number of infected with coronavirus?,39,0.6001267744758577,0.6147100952759493
479,About Coronavirus,How Many Infected,What is the number of infected people?,39,0.6035561825424569,0.6147100952759493
609,Coronavirus Recommendations,People At Risk,Who are really at risk?,40,0.737559828099338,0.67707250701617
618,Coronavirus Recommendations,Children,is there any risk for my kids?,40,0.7585830655942782,0.67707250701617
441,Coronavirus Recommendations,People At Risk,Who is at risk when it comes to coronavirus?,40,0.7286637115700354,0.67707250701617
730,Coronavirus Recommendations,Actions At Home,Is there anything i can do to decrease the risk on COVID-19 infection?,40,0.699736331245284,0.67707250701617
866,About Coronavirus,Infection Of Pets,is my cat at risk,40,0.8112222344197476,0.67707250701617
488,Coronavirus Recommendations,Actions If At Risk,What do I do if I am at risk ,40,0.5030901789324869,0.67707250701617
790,Coronavirus Recommendations,People At Risk,Who are at the highest risk of infection?,40,0.38018159990403894,0.67707250701617
765,Coronavirus Recommendations,Sick Child,What to do if my child is at risk?,40,0.7447169983976734,0.67707250701617
875,Coronavirus Recommendations,Not At Risk,i'm low risk but am i still in danger?,40,0.726432398879584,0.67707250701617
182,Coronavirus Recommendations,Actions At Home,how can i reduce risk at home,40,0.5390010743313661,0.67707250701617
336,Coronavirus Recommendations,Not At Risk,"i don't think I'm at risk, do I need to take any precautions?",40,0.7661878152428947,0.67707250701617
805,Coronavirus Recommendations,Actions At Home,What shall I do at my home to decrease the risk of contracting coronavirus?,40,0.8054980704618111,0.67707250701617
483,Coronavirus Recommendations,Not At Risk,"I am not at risk, what do I do to stay so.",40,0.7643390884330696,0.67707250701617
17,Coronavirus Recommendations,Children,is my son at risk of being infected?,40,0.4576544296217621,0.67707250701617
14,Coronavirus Recommendations,Not At Risk,"I am not at risk, is there anything I should do?",40,0.7339831050231338,0.67707250701617
265,Coronavirus Recommendations,Actions At Home,Do I need to take some special actions at home to decrease the risk of contracting COVID-19?,40,0.822101104434652,0.67707250701617
1042,Coronavirus Recommendations,People At Risk,Am I at risk?_,40,0.5030901789324869,0.67707250701617
2,Coronavirus Recommendations,Actions If At Risk,What to do if I'm one of the people with a risk profile?,40,0.6521286873538558,0.67707250701617
319,Coronavirus Recommendations,People At Risk,Who are especially at risk of infection?,40,0.7302077324297325,0.67707250701617
373,Coronavirus Recommendations,Public Transport,How can public transportation be used during the outbreak?,41,0.4007561507164952,0.4086564050086518
247,Coronavirus Recommendations,Public Transport,is it a bad idea to use public transport,41,0.5010310281363907,0.4086564050086518
1049,Coronavirus Recommendations,Public Transport,What are the rules for using the public transport?,41,0.4510838784012628,0.4086564050086518
417,Coronavirus Recommendations,Public Transport,Is it fine if I use public transport?,41,0.19139073232681889,0.4086564050086518
526,Coronavirus Recommendations,Public Transport,what should i do if i use public transportation,41,0.23808904215275822,0.4086564050086518
794,Coronavirus Recommendations,Public Transport,Is public transport working?,41,0.5592287340315368,0.4086564050086518
592,Coronavirus Recommendations,Public Spaces,What do you recommend when taking public transport ,41,0.6522445030172309,0.4086564050086518
792,Coronavirus Recommendations,Public Transport,Can I use public transportation during the coronavirus outbreak?,41,0.4459945341426141,0.4086564050086518
513,Coronavirus Recommendations,Public Transport,Can I use public transport ,41,0.23808904215275825,0.4086564050086518
688,Employer Guidelines,Quarantine,One of my employees is lockdown under quarantine. How do I manage the situation?,42,0.6993943607231214,0.5367167380302769
256,Employer Guidelines,Quarantine,"my employee is under quarantine, what now?",42,0.4385609490570646,0.5367167380302769
1031,Employer Guidelines,Quarantine,What can i demand of an employee under quarantine,42,0.27851538401364484,0.5367167380302769
1003,Employer Guidelines,Quarantine,What do I about my employees that are in quarantine? Can they still work? ,42,0.6866819773509688,0.5367167380302769
284,Employer Guidelines,Quarantine,What can I do if one of my employees is under quarantine?,42,0.461061539604838,0.5367167380302769
