, Domain,intent,text,centroids_id,dist_score,avg_dist_score
229,Coronavirus Recommendations,Pregnant,"i'm having a baby, should I be worried?",0,0.4707714349018532,0.47077143490185325
1021,Coronavirus Recommendations,Children,should i worry about my kids?_,0,0.47077143490185325,0.47077143490185325
571,About Coronavirus,Infected Twice,can people get infected again,1,0.4988988076816187,0.5485516905816024
286,About Coronavirus,Methods of Transmission,how does it infect people,1,0.3866538634694043,0.5485516905816024
868,About Coronavirus,How Many Infected,people infected worldwide,1,0.6543777520557622,0.5485516905816024
956,About Coronavirus,Methods of Transmission,How does the virus travel from people to people?,1,0.6542763391196242,0.5485516905816024
538,Employer Guidelines,Daycare,What can I do if my employees can’t work because of the schools are closed ,2,0.36995519524548526,0.36995519524548526
681,Employer Guidelines,Daycare,what can I do if my employee cannot come to work because of his child's school is closed due to coronavirus,2,0.36995519524548526,0.36995519524548526
671,About Coronavirus,Symptoms,What symptoms do you have when infected with Corona ,3,0.0,0.0
318,Coronavirus Recommendations,Not At Risk,I'm not part of any known risk groups. What is my actions?,4,0.36612145018731296,0.366121450187313
214,Coronavirus Recommendations,Not At Risk,what can i do if i am not in the known risk groups,4,0.366121450187313,0.366121450187313
52,Coronavirus Recommendations,Employer,what is the employer supposed to do to protect the employees? ,5,0.4507147641381542,0.5046336451854853
73,Coronavirus Recommendations,Employer,what is the employer supposed to do to protect the employees? ,5,0.4507147641381542,0.5046336451854853
378,Coronavirus Recommendations,Employer,I am an employer. How do I protect my employees?,5,0.3570080122732588,0.5046336451854853
381,Employer Guidelines,Sick Employee,What of my employees (I'm the employer) has been affected by the virus. What to do?,5,0.7984969251265241,0.5046336451854853
185,Employer Guidelines,Sick Employee,what do i do as an employer if an employee is infected,5,0.6138593931635613,0.5046336451854853
556,Coronavirus Recommendations,Employer,If I am an employer how can I protect my employees? ,5,0.3570080122732588,0.5046336451854853
316,Coronavirus Recommendations,Doctor,When should I go to the doctor?,6,0.12992851126802682,0.24468350087122628
849,Coronavirus Recommendations,Doctor,When do I have to go to the doctor?,6,0.12992851126802682,0.24468350087122628
439,Coronavirus Recommendations,Doctor,When can I go to the doctor?,6,0.12992851126802682,0.24468350087122628
787,Coronavirus Recommendations,Doctor,When should i go to the doctor?,6,0.12992851126802682,0.24468350087122628
994,Coronavirus Recommendations,Doctor,Do I go to the doctor if I have corona? ,6,0.40505901081320095,0.24468350087122628
485,Coronavirus Recommendations,Doctor,What symptoms do you have to have before you go to a medical doctor ,6,0.7728379285484483,0.24468350087122628
56,Coronavirus Recommendations,Doctor,when should I go to the doctor+,6,0.12992851126802682,0.24468350087122628
606,Coronavirus Recommendations,Doctor,Should I go to the doctor?,6,0.12992851126802682,0.24468350087122628
665,About Coronavirus,What Is Coronavirus,What is Corona ,7,0.0,0.0
165,Contact,Hotline,i would like to get hold of the hotline,8,0.645477258095996,0.6737549380436053
929,Employer Guidelines,Quarantine,"one of us is under quarantine, we would like to know how to proceed",8,0.7226406255013278,0.6737549380436053
184,Coronavirus Recommendations,Student,i would like information for students during the pandemi,8,0.685578679848187,0.6737549380436053
209,Coronavirus Recommendations,Public Spaces,i would like to get recommendations on how to behave in the public,8,0.6413231887289106,0.6737549380436053
407,Coronavirus Recommendations,Pet,What do I do with my dog if I got a positive corona test?,9,0.4008676886541359,0.4008676886541359
597,Coronavirus Recommendations,Pet,If I am tested positive for Coronavirus what shall I do with my dog?,9,0.40086768865413597,0.4008676886541359
1013,Coronavirus Recommendations,Postponed Surgeries,Can you still get surgery during corona virus?,10,0.0,0.0
710,About Coronavirus,Pandemic,what is a pandemic,11,0.24581564503991393,0.4691369793877109
834,About Coronavirus,Pandemic,can you tell me what a pandemic is,11,0.6898837070813518,0.4691369793877109
772,About Coronavirus,Pandemic,What is pandemic?,11,0.24581564503991393,0.4691369793877109
573,About Coronavirus,Pandemic,what is a pandemic?,11,0.24581564503991393,0.4691369793877109
1037,About Coronavirus,Pandemic,What is a pandemic?,11,0.24581564503991393,0.4691369793877109
684,About Coronavirus,Pandemic,do you know what a pandemic is,11,0.6558225889539642,0.4691369793877109
980,About Coronavirus,Pandemic,What is a pandemic and who decides it,11,0.8120914052019241,0.4691369793877109
307,About Coronavirus,Pandemic,What is a pandemic?,11,0.24581564503991393,0.4691369793877109
976,About Coronavirus,Strategy,How do we fight the coronavirus pandemic?,11,0.8353568880525879,0.4691369793877109
656,About Coronavirus,Methods of Transmission,how is it transmitted,12,0.30399289234422877,0.39797026182012335
466,About Coronavirus,Methods of Transmission,How does the virus get transmitted?,12,0.6011741818426747,0.39797026182012335
811,About Coronavirus,Methods of Transmission,How can coronavirus be transmitted?,12,0.27313262179621906,0.39797026182012335
386,About Coronavirus,Methods of Transmission,How is the disease transmitted?,12,0.6632566313451794,0.39797026182012335
542,About Coronavirus,Methods of Transmission,How is the coronavirus transmitted?,12,0.27313262179621906,0.39797026182012335
343,About Coronavirus,Methods of Transmission,How is Coronavirus transmitted?,12,0.27313262179621906,0.39797026182012335
645,Employer Guidelines,Refusal To Work,"What are my rights, if one of my employees refuses to come to work because of coronavirus?",13,0.0,0.0
43,Employer Guidelines,Refusal To Travel,are my employees allowed to refuse travelling because of corona?,14,0.619432470797413,0.6489218385231577
1038,Employer Guidelines,Refusal To Travel,Can anyone in my team refuse to travel during the pandemia?,14,0.8611980632700293,0.6489218385231577
253,Employer Guidelines,Refusal To Travel,"one of my guys refuses to go abroad, can he refuse to do that?",14,0.8557356844237719,0.6489218385231577
275,Employer Guidelines,Refusal To Travel,Can an employee refuse to travel due to Coronavirus?,14,0.552423406618762,0.6489218385231577
833,Employer Guidelines,Refusal To Travel,Can Employees Refuse To Travel Out Of Fear Of Contracting coronavirus?,14,0.7128827532769532,0.6489218385231577
674,Employer Guidelines,Refusal To Travel,Can any of my workers refuse to travel during the pandemic?,14,0.7929342621875514,0.6489218385231577
738,Employer Guidelines,Refusal To Travel,Can my employee refuse to travel because of coronavirus?,14,0.41927318824066473,0.6489218385231577
531,Employer Guidelines,Refusal To Travel,Is ok for an employee to refuse to travel ,14,0.6325714369068269,0.6489218385231577
535,Employer Guidelines,Refusal To Travel,can my employee refuse to travel?,14,0.3938452809864475,0.6489218385231577
578,Gatherings,Arranging Gathering,What do I do if I want to celebrate my birthday ,15,0.9919443722819319,0.7726755815802206
582,Gatherings,Gathering Precautions,What shall I do when having a wedding ,15,0.9989217353351572,0.7726755815802206
584,Coronavirus Recommendations,Contact With Infected,my friend just tested positive and we hung out ealier this week. what do i do,15,0.9950865261843437,0.7726755815802206
155,Coronavirus Recommendations,Sick Child,What do I need to do with my kid has fever?,15,0.9908620141711278,0.7726755815802206
0,Coronavirus Recommendations,Pet,_,15,0.10743958051848407,0.7726755815802206
149,Employer Guidelines,Sick Employee,no,15,0.10743958051848407,0.7726755815802206
127,About Coronavirus,Coronavirus Versus Influenza,_,15,0.10743958051848407,0.7726755815802206
128,About Coronavirus,Latest News,_,15,0.10743958051848407,0.7726755815802206
129,About Coronavirus,Status,_,15,0.10743958051848407,0.7726755815802206
130,About Coronavirus,Strategy,_,15,0.10743958051848407,0.7726755815802206
131,About Coronavirus,Testing,_,15,0.10743958051848407,0.7726755815802206
132,About Coronavirus,Fear,_,15,0.10743958051848407,0.7726755815802206
133,Coronavirus Recommendations,Health Authority Recommendations,_,15,0.10743958051848407,0.7726755815802206
134,Coronavirus Recommendations,Public Spaces,_,15,0.10743958051848407,0.7726755815802206
135,Coronavirus Recommendations,Illness,_,15,0.10743958051848407,0.7726755815802206
136,Coronavirus Recommendations,Contact With Infected,_,15,0.10743958051848407,0.7726755815802206
137,Coronavirus Recommendations,Employer,_,15,0.10743958051848407,0.7726755815802206
138,Coronavirus Recommendations,Citizen,_,15,0.10743958051848407,0.7726755815802206
663,Employer Guidelines,Sick Employee,what can I do if someone in my team gets the virus?,15,0.9777138919086056,0.7726755815802206
143,About Coronavirus,Status,ma name jef,15,0.9989217353351572,0.7726755815802206
144,About Coronavirus,Strategy,watadarastage,15,0.998921735335157,0.7726755815802206
642,Coronavirus Recommendations,Border,I have a question about the frontiers locked?,15,0.998921735335157,0.7726755815802206
628,Coronavirus Recommendations,Postponed Surgeries,What surgery appointments have been moved?,15,0.9989217353351572,0.7726755815802206
615,Coronavirus Recommendations,Pregnant,I'm expecting a baby. what can I do?,15,0.9960639323933149,0.7726755815802206
666,About Coronavirus,Coronavirus Versus Influenza,isnt coronavirus just like to flu?,15,0.986937863341321,0.7726755815802206
510,Coronavirus Recommendations,Border,Can I cross the border to Germany ,15,0.9922509368902813,0.7726755815802206
559,Gatherings,Cancelling Gathering,Why do the government advise us not to have parties ,15,0.9956141914412968,0.7726755815802206
198,About Coronavirus,Symptoms,what kind of symptomps do you have if infected by covis19,15,0.9962131552897072,0.7726755815802206
416,Coronavirus Recommendations,Visiting Elderly,Can I still visit my nan in her home?,15,0.9804106400530129,0.7726755815802206
411,Gatherings,Arranging Gathering,"I'm arranging a party, is there something in particular I should do to prepare?",15,0.9890295395435561,0.7726755815802206
406,About Coronavirus,What Do We Know About Coronavirus,What is the current knowledge around the corona outbreak?,15,0.9891621816991674,0.7726755815802206
203,About Coronavirus,Mortality Rate,how highg is the mortality with covid19,15,0.998921735335157,0.7726755815802206
388,About Coronavirus,Coronavirus Versus Influenza,Is the corona outbreak equal to the flu?,15,0.9898297602260495,0.7726755815802206
383,Employer Guidelines,Refusal To Travel,Are my employees allowed to deny business related travels due to the outbreak? ,15,0.9839198325273367,0.7726755815802206
375,Employer Guidelines,Daycare,"Schools and daycares are closed due to the outbreak. What is my rights as an employer, when employees do not have the opportunity to have someone to look after their child? ",15,0.9788643073471721,0.7726755815802206
372,Coronavirus Recommendations,Visiting Elderly,Is it OK for me still til visit senior citizens in their home or at their nursing homes?,15,0.9835304548985052,0.7726755815802206
312,Gatherings,Gathering Precautions,"As an event organizer, what actions do I need to take?",15,0.9808742860377619,0.7726755815802206
279,About Coronavirus,What Do We Know About Coronavirus,what do you as a chatbot know about corona that I can't read in the news?,15,0.9913305327310701,0.7726755815802206
276,Coronavirus Recommendations,Doctor,"I have started coughing, when should a call the doctor?",15,0.9965145543482193,0.7726755815802206
272,Gatherings,Gathering Precautions,I am arranging a gathering for 20 bridge game members. can I still go through with the event?,15,0.9813304560377907,0.7726755815802206
269,Gatherings,Arranging Gathering,"I am a event manager for a night club in cph with the new rules, can i then arrange club nigths?",15,0.9930505739271736,0.7726755815802206
227,About Coronavirus,Strategy,wht is the current startegy?,15,0.9977545251165026,0.7726755815802206
266,Coronavirus Recommendations,Educating Children On Coronavirus,Should I be educating the same way my child during the COVID-19?,15,0.9890749842143465,0.7726755815802206
251,Employer Guidelines,Sick Employee,"one of my employees tells me that he is sick but he doesn't know if it is corono, what do I do? do I send him home just like that?",15,0.9818327888280821,0.7726755815802206
418,Coronavirus Recommendations,Actions At Home,Do I have to perform particular actions at home to keep myself and my family safe?,15,0.9844948323387699,0.7726755815802206
160,Coronavirus Recommendations,Public Transport,Is it safe to take the bus?,15,0.985838743158498,0.7726755815802206
431,Coronavirus Recommendations,Returning From Travel,"I've just returned from [country], is there anything special I should be aware of or something I should do?",15,0.9937756555216032,0.7726755815802206
436,Coronavirus Recommendations,Citizen,Is tehre anything in particular I can do as a citizen to help coronavirus pass faster?,15,0.9899201151629389,0.7726755815802206
163,Coronavirus Recommendations,Student,How can I continue my education during the pandemic?,15,0.9942736006463232,0.7726755815802206
164,Employer Guidelines,Sick Employee,What are the signs someone has coronavirus?,15,0.9833479849113441,0.7726755815802206
552,Gatherings,Arranging Gathering,how should i react if i'm arranging a gatering,15,0.9954423993038066,0.7726755815802206
541,Employer Guidelines,Daycare,what can i do if my employee cant work beacuse no one can take care of their child,15,0.9817462967637606,0.7726755815802206
170,About Coronavirus,Infection Through Food,Can I catch coronavirus from eating takeout?,15,0.9913060813450909,0.7726755815802206
173,About Coronavirus,Coronavirus Versus Influenza,_,15,0.10743958051848407,0.7726755815802206
514,Coronavirus Recommendations,Returning From Travel,i just came home from traveling. what should i do,15,0.9851014518670119,0.7726755815802206
512,Coronavirus Recommendations,Visiting Elderly,Can I visit my grandma in the care center ,15,0.9890501540215297,0.7726755815802206
126,About Coronavirus,Treatment,_,15,0.10743958051848407,0.7726755815802206
495,Coronavirus Recommendations,Postponed Surgeries,What sorts of operations has been postponed due to Corona ,15,0.99229037821977,0.7726755815802206
492,Coronavirus Recommendations,Swimming Hall,Is it dangerous to go swimming in a public bathroom ,15,0.9871894623095104,0.7726755815802206
181,Coronavirus Recommendations,Public Transport,can i still use publictransport,15,0.9925988009209236,0.7726755815802206
182,Coronavirus Recommendations,Actions At Home,how can i reduce risk at home,15,0.9886481266321638,0.7726755815802206
187,Employer Guidelines,Refusal To Travel,can an eomployee fefuse to travel because of coronavirus,15,0.9896128038317793,0.7726755815802206
189,Employer Guidelines,Daycare,as an employer. what can i do if an employee cant send children to school or daycare,15,0.9868501557127338,0.7726755815802206
452,About Coronavirus,Pandemic,"I wanted to ask what a pandemic was, is that a videogame?",15,0.9926327702247343,0.7726755815802206
193,Gatherings,Gathering Precautions,what precorsiens do i have to make if i am hosting an event,15,0.9937429220303613,0.7726755815802206
434,Coronavirus Recommendations,Contact With Infected,"I've shaken hands with someone who is Coronavirus positive, what should I do?",15,0.9843240423601438,0.7726755815802206
125,About Coronavirus,Methods of Transmission,_,15,0.10743958051848407,0.7726755815802206
117,Coronavirus Recommendations,Citizen,As a conscious resident of the U.S. how can I mitigate the spread of the virus?,15,0.9955996911977948,0.7726755815802206
123,About Coronavirus,What Do We Know About Coronavirus,_,15,0.10743958051848407,0.7726755815802206
971,Gatherings,Arranging Gathering,Can I still have a gathering of people? What do I have to do in that case? ,15,0.9883476173403973,0.7726755815802206
893,Coronavirus Recommendations,Precautions,is my Easter flight going to get cancelled,15,0.9899608609463786,0.7726755815802206
889,Coronavirus Recommendations,Pregnant,"i've got a baby on the way, what to do",15,0.9922350431285298,0.7726755815802206
887,Coronavirus Recommendations,People At Risk,is grandma or grandpa in danger,15,0.9907381669549056,0.7726755815802206
884,Gatherings,Arranging Gathering,it's my graduation can i celebrate with my friends,15,0.99485473005975,0.7726755815802206
53,Coronavirus Recommendations,Citizen,can i take an action to minimize the spead of coronavirus? ,15,0.9863160008847172,0.7726755815802206
875,Coronavirus Recommendations,Not At Risk,i'm low risk but am i still in danger?,15,0.9841290960870294,0.7726755815802206
872,Coronavirus Recommendations,Contact With Infected,my boyfriend is positive what do i do,15,0.9960561166456919,0.7726755815802206
894,Coronavirus Recommendations,Returning From Travel,"i just came back from france, can i see my sister",15,0.9944016358265301,0.7726755815802206
972,Gatherings,Gathering Precautions,How do I keep a gathering of people safe? ,15,0.9879828930161052,0.7726755815802206
124,About Coronavirus,Symptoms,_,15,0.10743958051848407,0.7726755815802206
61,About Coronavirus,Fear,how dangerous is coronvirus?,15,0.9918793532106984,0.7726755815802206
16,Coronavirus Recommendations,Doctor,at what point should I seek medical help?,15,0.997864806679882,0.7726755815802206
987,Coronavirus Recommendations,Public Spaces,Do I need a mask when I go outside? What are the rules for social distancing?,15,0.9891479194583447,0.7726755815802206
844,Coronavirus Recommendations,Closed Shops,_,15,0.10743958051848407,0.7726755815802206
843,Coronavirus Recommendations,Contact With Infected,What to do if you were potentially exposed to someone with coronavirus?,15,0.9860298959359625,0.7726755815802206
842,Coronavirus Recommendations,Returning From Travel,_,15,0.10743958051848407,0.7726755815802206
841,Coronavirus Recommendations,Postponed Surgeries,_,15,0.10743958051848407,0.7726755815802206
861,About Coronavirus,Fear,am i likely to end up in the hospital or die?,15,0.991843874659732,0.7726755815802206
959,About Coronavirus,Latest News,Is there any news today?,15,0.9958249000660069,0.7726755815802206
897,Coronavirus Recommendations,Student,do i go to classes at uni,15,0.9922501540283344,0.7726755815802206
902,Coronavirus Recommendations,Closed Shops,can i still buy ice cream,15,0.9878494642862379,0.7726755815802206
957,About Coronavirus,Treatment,Is there a cure for the virus?,15,0.993773149178003,0.7726755815802206
945,Coronavirus Recommendations,Purchasing Groceries,Is it safe to buy food? ,15,0.9866178747354611,0.7726755815802206
940,Coronavirus Recommendations,Actions If At Risk,I have a lung disease. What should I do?,15,0.9989217353351569,0.7726755815802206
28,Contact,Hotline,ho can I get in touch with you fast?,15,0.9957512731514638,0.7726755815802206
29,Gatherings,Cancelling Gathering,we can we not meet up in crowds?,15,0.996900784602942,0.7726755815802206
928,Employer Guidelines,Daycare,"our employee is saying that she cannot leave her child alone at home, we don't know what to do",15,0.9858185694115598,0.7726755815802206
924,Employer Guidelines,Sick Employee,What are we supposed to do as a company if one of us is infected?,15,0.9925256843326506,0.7726755815802206
919,Coronavirus Recommendations,Visiting Elderly,can we go and visit our granny?,15,0.9849279118653114,0.7726755815802206
900,Employer Guidelines,Refusal To Travel,we have a business trip to florida but an employee is scared to come,15,0.9942916991309191,0.7726755815802206
33,Coronavirus Recommendations,Health Authority Recommendations,_,15,0.10743958051848407,0.7726755815802206
915,Coronavirus Recommendations,Sick Child,So... What do we do if our daughter gets it?,15,0.9916906831087884,0.7726755815802206
36,Coronavirus Recommendations,Pregnant,am I at risk if I am preganant and get corona?,15,0.9876436586538013,0.7726755815802206
913,Coronavirus Recommendations,Precautions,so do i need to wipe all doorknobs?_,15,0.9935588328534708,0.7726755815802206
911,About Coronavirus,What Do We Know About Coronavirus,can i see the most recent statistics on contagion,15,0.9966678503038302,0.7726755815802206
906,Coronavirus Recommendations,Border,can i buy stuff in Germany,15,0.9901991502888529,0.7726755815802206
904,Coronavirus Recommendations,Purchasing Groceries,what if i run out of toilet paper,15,0.998921735335157,0.7726755815802206
41,Employer Guidelines,Sick Employee,what should my direct report do if he is infected with corona virus?,15,0.9889308521462021,0.7726755815802206
903,Coronavirus Recommendations,Sick Child,"my kid is coughing, does he need to see the doctor or to be taken to the hospital",15,0.9856956525991026,0.7726755815802206
918,Coronavirus Recommendations,Border,"based on the news about the border lockout, can we travel abroad?",15,0.9914168430247838,0.7726755815802206
830,Coronavirus Recommendations,Visiting Elderly,_,15,0.10743958051848407,0.7726755815802206
1009,Coronavirus Recommendations,Children,Is coronavirus bas for children?,15,0.9906531631292582,0.7726755815802206
826,Coronavirus Recommendations,Sick Child,How should I look after my child that is infected with coronavirus?,15,0.9826648893920668,0.7726755815802206
759,Coronavirus Recommendations,Precautions,_,15,0.10743958051848407,0.7726755815802206
752,Gatherings,Gathering Precautions,_,15,0.10743958051848407,0.7726755815802206
828,Coronavirus Recommendations,Visiting Elderly,_,15,0.10743958051848407,0.7726755815802206
744,Employer Guidelines,Quarantine,What to do if my employee is undert quaranteen?,15,0.9945293520951656,0.7726755815802206
736,Employer Guidelines,Refusal To Work,What to do if my employee do not want to work because od Coronavirus?,15,0.9822556482973617,0.7726755815802206
731,Coronavirus Recommendations,Not At Risk,"im young and healthy, but should i take any precautions",15,0.9949632801236482,0.7726755815802206
102,Gatherings,Cancelling Gathering,because they have seen thousands of deaths,15,0.9989217353351569,0.7726755815802206
7,Coronavirus Recommendations,Health Authority Recommendations,What should I do?,15,0.10743958051848407,0.7726755815802206
713,Employer Guidelines,Daycare,_,15,0.10743958051848407,0.7726755815802206
696,Gatherings,Arranging Gathering,I was preparing like a big meeting. what should I do?,15,0.9912415036862295,0.7726755815802206
111,About Coronavirus,Fear,How fearful should I be of Coronavirus?,15,0.9900881230133196,0.7726755815802206
687,Employer Guidelines,Daycare,Schools are closed and someone in my team has no one to take care of his daughter. Can I do anything about it?,15,0.9768545985941784,0.7726755815802206
1,Coronavirus Recommendations,People At Risk,_,15,0.10743958051848407,0.7726755815802206
245,Coronavirus Recommendations,Border,who is allowed to cross the borders? what if I'm just going on a short visit to my mom?,15,0.985039556231397,0.7726755815802206
119,About Coronavirus,Status,Which country has the most number of casualties due to Corona virus?,15,0.9875236289550544,0.7726755815802206
669,Employer Guidelines,Refusal To Work,Someone in my team doesn't want to go to work because of the pandemic. What can I do?,15,0.9741737288829923,0.7726755815802206
700,Gatherings,Gathering Precautions,How can I organise an event?,15,0.9922369290986592,0.7726755815802206
785,Coronavirus Recommendations,Not At Risk,_,15,0.10743958051848407,0.7726755815802206
750,Coronavirus Recommendations,Sick Child,Is there some special procedure for people whose kids got infected with coronavirus?,15,0.9869452568998053,0.7726755815802206
89,Coronavirus Recommendations,Pregnant,buy diapers.,15,0.9918331229348967,0.7726755815802206
825,Coronavirus Recommendations,Postponed Surgeries,_,15,0.10743958051848407,0.7726755815802206
823,Coronavirus Recommendations,Actions At Home,_,15,0.10743958051848407,0.7726755815802206
817,Coronavirus Recommendations,Returning From Travel,_,15,0.10743958051848407,0.7726755815802206
816,Employer Guidelines,Quarantine,_,15,0.10743958051848407,0.7726755815802206
815,Coronavirus Recommendations,Public Transport,what should i do if i travel by bus every day,15,0.9929058422639263,0.7726755815802206
814,Coronavirus Recommendations,People At Risk,who are most af risk of getting hospitalized due to covid-19,15,0.9861619925720703,0.7726755815802206
91,Coronavirus Recommendations,Mask,not unless it's halloween,15,0.998921735335157,0.7726755815802206
808,About Coronavirus,What Do We Know About Coronavirus,How much knowledge we already have about coronavirus?,15,0.9910497269457215,0.7726755815802206
1019,Coronavirus Recommendations,Visiting Elderly,Can I visit my older relatives during corona?,15,0.9876621981395884,0.7726755815802206
964,About Coronavirus,Infection Of Pets,Can animals catch the virus?,15,0.9927038888505522,0.7726755815802206
88,Coronavirus Recommendations,Actions If At Risk,send thoughts and prayers,15,0.9960554333499897,0.7726755815802206
84,Coronavirus Recommendations,Precautions,What do I need to do if I'm going away?,15,0.9849450267186804,0.7726755815802206
800,About Coronavirus,Incubation Period,_,15,0.10743958051848407,0.7726755815802206
668,About Coronavirus,Latest News,what is the latest news,16,0.18810160208330962,0.34908529163773794
673,About Coronavirus,Latest News,What’s the latest news about Corona ,16,0.3833900959967136,0.34908529163773794
