text,centroids_id,dist_score
ค่าเทอมเทอมละกี่บาทคะ,-1,0.9357168214448606
เรียนปีละกี่เทอม,-1,0.8945948021520808
จบสายศิลป์เรียนได้ไหม,-1,0.9263630335689721
ลงทะเบียนเรียนตอนไหนครับ,-1,1.0038025553334469
กี่ปีจบ,-1,0.9202547814575888
หวัดดีครับ,-1,1.0166977382179907
สาขานี้เรียนยากไหม,-1,0.9275695269898783
ขอลิ้งค์เว็บไซต์สาขาหน่อย,-1,0.9701562610100256
จบสายศิลป์เข้าเรียนที่นี่ได้ไหมครับ,-1,0.9512700202830726
ขอดูหลักสูตรหน่อย ,-1,0.9939250953432371
ขอเว็บไซต์คณะหน่อยหน่อยครับ,-1,0.9971427417941773
ค่าหอราคาเท่าไหร่ครับ,-1,0.9548059183886356
มีที่พักไหมครับ,-1,1.0021289967821982
ค่าเทอม เทอมละเท่าไหร่ครับ,-1,0.938248426006289
ลงทะเบียนเรียนวันไหนคะ,-1,1.0055339699182229
ขอสอบถามเรื่องหลักสูตรของสาขาวิชานี้หน่อยค่ะ,-1,0.9943705283937411
ขอเว็บสาขาหน่อย,-1,0.983465141161011
จบไปทำอะไร ,-1,0.968377321319424
ค่าหอพักราคาเท่าไรหรอคะ,-1,0.9539727382039517
ขอเว็บไซต์สาขาหน่อยครับ,-1,0.9558465550753256
ขอวิธีการดรอปเรียนหน่อยค่ะ,-1,0.9821249157817289
ที่นี่เรียนยากรึเปล่า,-1,0.9491373224845756
จบไปทำงานอะไรได้บ้าง,-1,0.9581526800796659
ค่าเทอมราคาเท่าไร,-1,0.9488332653338046
ตึกสาขาตั้งอยู่ที่ไหน,-1,0.972757550046823
เรียนกี่เทอมต่อปี,-1,0.9198145763976872
หอพักราคาเท่าไหร่คะ,-1,0.9563162513802628
hi,-1,1.0166977382179907
เรียนกี่ปีจบคะ,-1,0.8884074120070906
สนใจสมัครเรียนอย่างไรครับ,-1,1.0079598080204895
ค่าหอพักราคาเท่าไรคะ,-1,0.9495328596579512
ตึกสาขาอยู่ตรงไหนคะ,-1,0.9727575500468231
Hi,-1,1.0021289967821982
ที่นี่เรียนปีละกี่เทอม,-1,0.8906281371239175
ที่นี่เรียนยากไหมคะ,-1,0.9377076861456
จบไปทำอะไรคะ,-1,0.968377321319424
ที่นี่เรียนยากไหมครับ,-1,0.9377076861456
ให้ลงทะเบียนเรียนวันไหนหรอครับ,-1,0.9961250050951709
ขอรายละเอียดหลักสูตรหน่อย,-1,1.0035319264822489
เทอมนี้มีวิชาอะไรบ้าง ,-1,0.9869905951051585
จบสายศิลป์มาเรียนได้รึเปล่าคะ,-1,0.9416074097129759
ขอระเบียบการหอพัก,-1,0.9833477295852571
ขอรายวิชาในสาขาหน่อย,-1,0.9905374087685486
อรุณสวัสดิ์ค่ะ :),-1,1.0166977382179907
ขอระเบียบการดรอปเรียนหน่อยค่ะ,-1,0.9749594161131975
ค่าเทอมลดกี่เปอเซ็นคะช่วงโควิด,-1,0.9778670205269704
เปิดเรียนปีการศึกษาละกี่เทอมคะ,-1,0.9673632255491584
สวัสดีครับ ตึกสาขาตั้งอยู่ตรงไหนครับ,-1,0.9729606206109754
สายศิลป์เรียนได้ไหม,-1,0.9473556351049478
จบอะไรถึงเรียนได้คะ,-1,0.9437431703706088
Hi,-1,1.0021289967821982
เปิดเทอมวันไหน ,-1,1.0038025553334469
ขอเว็บไซต์สาขาหน่อย,-1,0.9558465550753256
สนใจเรียนสมัครอย่างไรคะ,-1,0.982003666229175
ขอเว็ปมหาลัยหน่อยจ้า,-1,1.0166977382179907
ค่าหอเท่าไหร่คะ,-1,0.9662432376369836
มีหอพักสำหรับนักศึกษามั้ยคะ,-1,0.9926549445232794
ขอดูหลักสูตรหน่อย,-1,0.9939250953432371
มีหอพักไหมครับ,-1,0.9791260895373314
เรียนกี่ปีครับ,-1,0.9068793389997067
เรียนจบไปทำงานอะไร,-1,0.9991220359562709
สวัสดีค่ะ ขอสอบถามเรื่องค่าเทอมหน่อยค่ะ,-1,0.9733058842781742
ตึกสาขาอยู่ที่ไหนครับ,-1,0.9724707323285351
มีที่พักไหมคะ,-1,1.0021289967821982
ค่าหอเท่าไหร่,-1,0.9662432376369836
เรียนแมทกี่ตัว,-1,0.9668798532031531
เรียนกี่ปีจบ,-1,0.8884074120070906
เรียนยากมั้ยคะ ,-1,0.9587446378935264
สวัสดีค่ะ,0,0.0
สวัสดี,0,0.0
สวัสดี,0,0.0
สวัสดีค่ะ ,0,0.0
สวัสดีครับ,0,0.0
สวัสดีจ้า,0,0.0
สวัสดี,0,0.0
สวัสดีค่ะ,0,0.0
สวัสดีครับ,0,0.0
สวัสดีครับ,0,0.0
ขอข้อมูลหลักสูตรหน่อยค่ะ,1,0.0
ขอข้อมูลหลักสูตรหน่อยครับ,1,0.0
ขอข้อมูลหลักสูตรหน่อย ,1,0.0
ค่าเทอมกี่บาท,2,0.0
ค่าเทอมกี่บาท,2,0.0
ค่าเทอมกี่บาท,2,0.0
เรียนยากไหม,3,1.1102230246251565e-16
เรียนยากไหม,3,1.1102230246251565e-16
เรียนยากไหม,3,1.1102230246251565e-16
เรียนยากไหมครับ,3,1.1102230246251565e-16
เรียนยากไหม,3,1.1102230246251565e-16
ค่าเทอมเท่าไหร่,4,0.0
ค่าเทอมเท่าไหร่,4,0.0
ค่าเทอมเท่าไหร่,4,0.0
ค่าเทอมเท่าไหร่ครับ ,4,0.0
ลงทะเบียนเรียนวันไหน ,5,0.0
ลงทะเบียนเรียนวันไหนครับ,5,0.0
ลงทะเบียนเรียนวันไหน ,5,0.0
